Number,Summary,Score,Network
1MvUF45vxZB9gsbCzmyPqQ,"The Completely Reimagined: 2024 to Escape"""" is a Parcast Original. For more episodes like this one, subscribe to Cults on Spotify, or wherever you listen to podcasts. Joanna was proven right again, but far from convincing her. She felt she'd already proven beyond doubt that her predictions were accurate. She asked God to keep Peter away from her for a month, if he wasn't her soul mate. When Peter failed to visit her the next month, Joanna's letter still sounding. She still saw him as a friend, and thus agreed to sign the document. But Joanna had trusted Pomeroy too much. What she actually signed was a statement declaring. She soon rejected him for God, after another man, Peter West, expressed an interest in her. Joanna prayed for a sign from the Lord. But this reaction, no matter how understandable, may have decreased her credibility in the minds of the men who were already looking for a reason to disbelieve her. Credits This episode is brought to you by the completely reimagined 2024 to escape with Ford copilot 360, a suite of advanced, standard driver assist technologies.",0,coarse2fine
1N0Tj6vmrxfYWubS0eA0hj,"Welcome to the first episode of the new season of the ATP World Tour Podcast! In this episode, we discuss the Indian Wells action and preview the upcoming French Open. We also discuss Maria Sharapova's return to the tour, the return of Stefanos Tsitsipas, and the rise and fall of Roger Federer. We look ahead to the Indian Open and discuss who we would like to see in singles and doubles, as well as our predictions for the doubles and mixed doubles events.  We also discuss the latest in the world of tennis news, including the latest updates on the Australian Open, Wimbledon and the US Open.",1,coarse2fine
1NF1JWmm9bOD4yiQIAiSrJ,"My command is this: Love each other as I have loved you. Greater love has no one than this to lay down one's life for as friends, you are my friends. I have told you this so that my joy may be in you, and that your joy may complete. If you do what I command, I will no longer call you servants, because a servant does not know his masters business. I will call you friends, for everything that I learned from my father, I have made known to you. You did not choose me, but I chose you and appointed you, so that you might go and bear fruit fruit that will last, and so that whatever you ask in my name, the Father will give you. This is my command, love each other in the word of the Lord has blessed.",0,coarse2fine
1NJzwYilHc12Cn3P2hAkeL,"The Full Moon in Virgo is so important because it's far more grounded and grounded. And that is why it's important to have a grounding Virgo full moon in your life. It's not just about the sex, it's about the love, and it's not only about the money, but it's also about the soul. And if you don't have a clear understanding of what that means, you're going to be missing out on a lot of good stuff.  In this episode, we talk about how the Virgo Full Moon is so grounding, and how it can be a great time for healing. We also talk about what to look for in a witch, and what to do when you see a witch in your area. We talk about our own personal experiences with the full moon and how we've learned to deal with it. We share some of our own experiences with it and what we've been able to learn from it and how you can use it in your own life.",1,coarse2fine
1NR3nDeqb0dW7Vog00V5WJ,"This episode is brought to you by Unexplained Mysteries, a Parcast Original. For more episodes like this one, subscribe to Parcast's other podcasts, Serial Killers, on Spotify, or wherever you listen to podcasts. In 1961, Betty Gail Hargis was found strangled to death in her home in Lexington, Oregon. The killer was a 19-year-old serial killer named Archie Arnold, who would go on to kill dozens of women over the course of his life. Parcasters - This week on The Dark Side Of, we take a deep dive into the dark side of the internet, and how it has impacted the way we think about the internet and how we view the world. Search for the full video on YouTube. Parcast's new original series, DICTATORS examines the reign of a real-life tyrant.",0,coarse2fine
1OhV8h2qzqSTJsTbEoZ2g9,"Best Job Ever"""" by Dr. C.K. Bray Book Summary Summary.",0,coarse2fine
1PB1QjdVvioF6k7YKBKkQZ,"This is the Secret"""" is the thirteenth episode of the Dunder Mifflin Nights podcast. Enjoy!  It's hard to believe it's been 14 years since the last episode, but here it is!",0,coarse2fine
1PDbp2SbU98zYd38Enu5tZ,"You are the creator of your own reality, and you are in the process of creating the reality of how you feel right now. The only way that those two realities can merge is for you to come with us in other words, because we are not going with you. You are the source of who you are, as well as the eternal well-being that you are. You can only help the others when you are tuned in, turned on, and in alignment with who you truly are. In your thriving, you are less concerned about the injustices of the world, because in your Thriving you are tuning to something other than the injustice of the World. You cannot help them as you suffer, but you can help them in your Clarity. Your power of influence is mighty. You will thrive when you tune into the vibration of the source within you, and as you tune yourself to that, you will thrive. It's just the magnificent balance of all that is, and when you decide to orient yourself toward, what feels best to you, as you focus upon it, you'll attune yourself to the vibrational center of your true center.",2,coarse2fine
1QgWndnYGtv7EXi0UWYitW,"In this episode, Molly and Beth talk about the importance of pivoting your path and how to get out of a rut you're stuck in. They also talk about what it's like to be in a relationship with someone who has been through it all and how it can be a positive thing for you and your business.  They also share some of their own personal stories of how they've pivoted their businesses and what they've learned along the way.",1,coarse2fine
1RgnPIj7xYVWrVAgPrMk2e,"What's up podcast! In this episode, I'm joined by two of my good friends and fellow machine learning team members, Rodrigo and Francisco. We talk about the evolution of machine learning and how it has evolved over the last 10 years. We also talk about how to use machine learning to improve your investment strategy. Hope you enjoy this episode! Don't forget to check out the companion YouTube channel called Machine Learning Secrets where we go into more detail on subjects ranging from Machine Learning, Data Science, and Artificial Intelligence. Thanks for listening!",1,coarse2fine
1RjC39Ilch6rBJfFRBJMbj,"Anton shares what you need to know before you launch your website on Shopify, before you contact your first supplier, and before you get your first sale.",2,coarse2fine
1RsgjqOAPQA3nisyjNhRXR,"I have been working on rebuilding my credit for the past few months and I am worried that I am going to get stuck with the same problem I have been dealing with for years.  What is a 78% rule?  Is there any way you can give a dealership authorization to send only your credit or your credit card to only a few places?    How to get a line of credit that is the only place you can get the best interest rates for you?   What is the difference between a 7/8 score and a 7.5/8?   How do you know if you are in the right place to get the loan?   Is there a way to get out of a bad credit score?   Can you get a car loan that you can't afford to pay back?   And what is the best way to use a credit card?   Mike and Mike answer these questions and more in this week's episode of The Financial Wellness Podcast.    Enjoy!  Don't forget to rate, review, subscribe and share the podcast!",2,coarse2fine
1STy1PKd5MLtccOTCcuKNB,"Just kidding, it's a fearcast. It's not a real fearcast, but it's just us talking about the future of the world and what we think is going to happen when the singularity comes into existence. This week, we talk to Angela Mazzanti, host of the popular podcast, The Mazzantino Show, about what it's like to live in a simulation of the past and how we can prepare for the future. We also talk about our favorite conspiracy theories and theories about the existence of life on the other side of the universe.",0,coarse2fine
1SdguXlFBsxMcYtdPyh0oH,"The Beautiful Trash"""" from Tissues was written by Caroline Reedy, arranged by Jack Mitchell, and read by Brandon Zelman and Matt Zimbrana.  Originally aired on November 16, 2019. The Story Pirates present """"The Beautiful Trash"""" by Caroline Reidy, narrated by Bobby Lord. This episode pairs nicely with the new book, The Beautiful Trash by author Caroline ReidY, which is available now!  ""The Beautiful trash"""" is a collection of poems written by children from across the world, including """"The Little Mermaid,"""" """"The Moon,"""" and """"The White Swan.""""  It features the voices of children from all over the world. The book is available for purchase at StoryPirates.org, and can be found on Amazon.com.   The book also comes with a coloring book, which can be used to write your own poems, or read them aloud to your friends and family. It can also be found in the Story Pirates library at Story Pirates.org.",0,coarse2fine
1TicQO3vAuYoPoS3XZeL6y,"Fanny Blankers-Koen"" is a Dutch Olympian who won four gold medals at the 1948 Summer Olympic Games.",0,coarse2fine
1U91Mj3wx0CCYbh1yddg5y,"Ask Dr. Neal your question about health, nutrition, diet, fitness, and more here: http://OLDPodcast.com/ask or call: 614-568-3643 Episode 950: Q&A - Should You Use Cupping Therapy?",0,coarse2fine
1UMDHZXjPuxIVnYyAS76fn,"Good night, baby girl. Good night. You need a good night's rest. You've been working so hard lately and you're tired of the stress of it all. It's time to take a break from the hustle and bustle and just let go. I'm here to help you relax and unwind. This is a safe place where you belong. A place we all can call home. Remember that safe place in the grass with the wind blowing, an easy way to let go and let go of all the stress and anxiety that comes with work and stress. I hope you enjoy today's ASMR episode. I'd love to hear from you..Please leave a review and rating after listening.   Sincerely, Bdsm the Wildlife.   Until next time.   --- This episode is sponsored by · Anchor: The easiest way to make a podcast.",3,coarse2fine
1UxCFPxYRwTLwqKNbmKkRh,"There are hundreds, possibly thousands of inmates sitting on death row who will probably die of old age before actually seeing an execution. On March 2nd 1984 a man was convicted for a double murder in Tennessee. From the moment he was arrested, this man wanted the death penalty.",2,coarse2fine
1ViBONBXnAVV5K5cmSnPID,"Sometimes it takes years to connect a killer's crimes. A March 6th 1959. A man was born who would eventually be tried for the murder of a single woman. She had been sexually assaulted and stabbed to death by who we now know was Faryon Wardrip. Toni Gibbs III was the next to fall prey to this man. On January 19th 1985, Tony offered Wardrip a ride home from work. Once inside, he began beating and screaming at her, forcing her to drive down an isolated dirt road to a field. A few days later, her naked body was found in a field a mile south of the Wichita County Line. Just days later police got a phone call from a man threatening to take his own life. When they arrived, this man, Ferry and Waldrop, confessed to Tina's unsolved murder. According to him, she reminded him of his ex-wife and that caused him to lose control and kill the young girl. He was sentenced to 35 years in prison and was paroled in 1997. Despite his heinous crime, Wardrip seemed to try and get his life under control post prison.",2,coarse2fine
1VqyL3ui763W5juwdtOl8u,"This episode is brought to you by the Buying Graphics Podcast, a Parcast Original. For more episodes like this one, subscribe to our podcast on Spotify, or wherever you listen to podcasts. Walt Disney was a genius of entertainment, a wizard of animation, and a master of the fine print. But in the 1940s, he was also a master manipulator. He used his genius to create a series of animated shorts that were used as a way to blackmail, blackmail, and blackmail again. This is the story of Bambi, the poor guy. This episode was narrated by Ken Napzok.",0,coarse2fine
1XplpPQ1jTNyiDWKzvtTV2,"Welcome to the first episode of my new podcast! In this episode, I talk about my recent trip to the hospital, my favorite video games, and a lot of other stuff. I hope you enjoy, sit down, and have a nice drink.",0,coarse2fine
1Yhi0Zw6i7apBTf1YsEkck,"I don't want to be a homie hot, I want you to be the homie you deserve"".""",0,coarse2fine
1ZoSdgRjZVVDrtaBpuQ3sm,"Welcome to the first episode of The Sporting Big & On Podcast! In this episode, I talk about my predictions for the 2019-2020 MLB season, as well as my thoughts on the Astros and Red Sox cheating in the World Series. I also give my predictions on who I think will win the Cy Young this year and who will be the MVP this year.",2,coarse2fine
1a8X3Df0CobqJNYPB4rCab,"What is the difference between perfection and completion? What are the differences between the two? How do you know when you have reached the end of the line? In this episode of Layer by Layer, Laura Horn Art shares her tips on how to find the balance between perfectionism and completion in the final stages of the painting process.  You can find out more about Laura and her work at www.laurahornart.com.au and follow her on Instagram at @laurehornart Check out her new online class Modern Mixed Media here: https://www.laurehornart.weebly.com/classes/modern-mixed-media-class/  Learn more about her online courses here:  https://laurehnart.co.uk/classes Get 20% off your first class by using the coupon code """"LAYERBYLEFT"""" at checkout and save 20% on that class up to the 19th of March 2020!  Laura Horn Art is an Australian fine art and mixed media artist based in Sydney, Australia.",3,coarse2fine
2WhmTkmk6Pf3MzOOfGShdx,"Welcome to the first episode of our podcast! In this episode, we talk about the movie Goosebumps 2, the movie we saw, and what it was like seeing it for the first time. We also talk about what we would do if we won the lottery. We hope you enjoy, sit down, and have a nice drink.",2,coarse2fine
2Xeg8BOxRCQMxQJNkRKNQg,"The average Joe is behind on their retirement savings. Imagine if your family could learn to budget, save and invest enough to become financially independent?",1,coarse2fine
2XxwpvnMErxxv1gIE7kYn4,"I'm attracted to you, but I'm not sure if it's an open relationship with my husband"""" - Brandi Love - Follow up to this statement.",0,coarse2fine
2Y8jc5V7n6TUyF5gFXzr5C,Jersey Shore Family Vacation is back and I can't wait for you guys to see what's going to happen in the new Jersey Shore Jersey Shore After Show. I break down the latest episode and give my thoughts on what I think is going on in the show. I also talk about what I want to see in the next episode.,0,coarse2fine
2Y9ZsvPmmCBm2ae9GbcKQF,"Welcome to the first episode of the podcast! In this episode, we talk about what it's like to be in Hong Kong, what we've been up to, and what we're looking forward to in the next few months. We also talk about some of the things we've noticed about the culture here and how we're adjusting to our new lifestyle.",0,coarse2fine
2YImecHJLfg0XXr5uqQQ0Y,"What's up team, in this episode the guys are back with a brand new episode of the podcast. They are joined by their good friend and co-host, Christian. We talk about a bunch of different topics including the worst time experience of our lives, the worst part of our life, and the worst place we've ever been. Hope you guys enjoy this new episode and let us know what you think of it in the comments section below!",2,coarse2fine
2YhkeuIWznFXfwPIPjNpIs,Welcome to the first episode of the Proof-of-Stake Podcast!,0,coarse2fine
2Yqc6JVpmh4x6ttfyGJmH0,"In this episode of the podcast, we talk about gender dysphoria and how it is a part of the human condition. The views and opinions expressed in this podcast do not reflect the views and policies of the producer and curator of this podcast, or the views or opinions of the host or the hostess.  Listeners discretion is advised as this podcast is for entertainment purposes only and is not for the purpose of teaching or research purposes.",3,coarse2fine
2ZXgyKhQTtNbW0FR27AJFx,You are always one decision away from a decision that you can't turn away from. You can't just say you are trying. You have to keep your ego in check when you have your provisional cape on. You must love what you have to respond to. I think that is and I don't know how we we still need our elders. You still have rooted issues. That's why you end up seeing those things. That is why you see those things in your life. It's because you are not doing the work that you are supposed to be doing. You're not doing what you're supposed to do. You don't have to do the work. You need to do what you are told to do and you need to be deliberate about doing that. And that's what we are talking about in this episode of the podcast. We are going to talk about what it means to be a woman in a male dominated industry and what it takes to be successful in that industry. We will also talk about the challenges that women face and how we can overcome them.  We will talk about how to get out of a toxic work environment and how to overcome the fear of being in a toxic environment.,2,coarse2fine
2a1FiJixYsXIV7iiW6USsm,"Habituate"""" is a noun meaning a frequent or habitual visitor to a place. As in, the aspiring painter was a habitue of art galleries. Habitue is often used for someone who frequently visits places of recreation or amusement, such as pool rooms, bars, or used bookstores. You may actually know the meaning of this word. Even if you haven't heard it before, that's because it sounds like and is related to a handful of other common words in English, including Habitue, habituate, and have it. It is habitually spelled HABITUNE with an acute accent mark over the 'e' despite its french-sounding pronunciation. Are you a habitual habitue? Find out more at dictionary.com word of the day. Have you subscribed to our podcast? Don't forget! It means you'll be the first to know whenever a new episode is released.",0,coarse2fine
2aTnF7mLdGbvvKfSP7I27P,"Welcome to the first episode of The Besties! In this episode, we talk about our first impressions of the new movie, """"Crazy Rich Asians"","" the new Pokemon card game, and our thoughts on the new Nintendo Switch game, """"The Rise of the Nintendo Switch."""" We also talk about what we would do with a billion dollars, and what we'd do if we won the World Series of Pokemon. We hope you enjoy, sit down, and have a nice drink.",0,coarse2fine
2aYfoNO3ia6i1s3k1ZhDwt,"You think death has one that you were wrong? That it's possible that maybe he isn't who he said he was?"""" These are the words and the feelings that come to mind when I read through chapter 19.",0,coarse2fine
2bA3SdEDHSWpbpX4BL5TUf,"Welcome to the first episode of the """"Don't We Think We've Thought of a Name Yet?"""" podcast. I talk about the Dreamcast, sports, video games, movies, anime, and other random things.",1,coarse2fine
2bI4lMf13AufxzbyaH83vI,"The Great Exfoliation Debate"" is a debate we have been having about exfoliation products for a while now. In this episode, Jessica and Natalie debate which products are the best for exfoliating your skin and which ones are not so much. We also discuss the pros and cons of each of the products we tried and what we think are the most effective for your skin. We hope you enjoy this episode and if you do, please give us a review and rating and subscribe to our podcast!",2,coarse2fine
2d3xRgazp3yOhjHQcdnVgV,"Unless the Lord builds the house, they labor in vain: that build it, unless the Lord keep the city, he watches and things saying that keeps it."""" -",0,coarse2fine
2dm87P6iUkLd01xhNzqa02,Today's episode features Gary Vee discussing what it takes to be successful in life. Search for the full video on YouTube.,1,coarse2fine
2eJJmwnyOXVOc8vbkIy8El,"This episode is brought to you by Unexplained Mysteries, a Parcast Original. For more episodes like this one, subscribe to Unexexplained Mysteries on Spotify, or wherever you listen to podcasts. On August 24th, 2017, somewhere between 11 p.m. and 1 a.m., a Boeing 777 was lost in the Indian Ocean off the coast of South East Asia. The plane was supposed to drop Malaysian air traffic control and immediately connect with Vietnam, but it never did. What happened to the plane and its 239 passengers and crew?",2,coarse2fine
2f7QjbmcaeVRCSXlWPNmkX,"This episode is brought to you by Con Artists, a Parcast Original. For more episodes like this one, subscribe to Con Artists on Spotify, or wherever you listen to podcasts. In the 1940s, Frank Granger was a successful con artist in Westchester County, New York. He would go on to become one of the most successful con artists of all time, defrauding more than $60,000,000 from his victims. But when the law caught wind of his fraud, it was only a matter of time before he was exposed. Parcasters - This week on The Dark Side Of, we take a look at the life and crimes of the Manson Family, and how they used their power to take over the world.",0,coarse2fine
2fKv4vfiIYV0DkteofeSkI,"You must love the Lord, your God with all your heart, all your soul, and all your mind. This is the first and greatest commandment.",0,coarse2fine
2gViultpkndrFPEVQJ3pOK,"Welcome to the first episode of Your Favourite Film is Awful, the weekly podcast where we try and make you laugh with our opinions on all things film related. In this episode we talk about the Oscars, the Oscars and the Oscars. We also talk about our favourite films of the year so far. We hope you enjoy this episode, and if you do please give us a review and rating and subscribe to the podcast, tell all your friends and tag us in your social media posts.",1,coarse2fine
2ghRFmlKIA3o7PuYDhH710,Why do we love villains? What makes a truly iconic baddie? He was one of the most enduring archetypes in popular culture.,0,coarse2fine
2h6p8z3CLHzkbRGX2hI5B8,"I Am"""" is a Parcast Original. For more episodes like this one, subscribe to Parcast's other podcasts, Tales From The Bud, on Spotify, or wherever you listen to podcasts. Chrysippus was a Greek philosopher who died at the age of 73. He lived to be a healthy old age, didn't he? He must have lived as well as his philosophy taught him to live, right? Or did he?",1,coarse2fine
2hQUxoBiju6vmoltsNn23b,"What's the best way to stand out and grow in a category that is already full of streamers playing different games, doing speedruns, casual playthroughs, challenge runs, and more?   6bitdadblog asks: What are some poor common practices that are easy to fall into and don't seem detrimental, but actually hurt your chances for success in the long run?   John Cadia asks: Should I be a variety streamer, or should I find a niche game?   Should I focus on promoting that stream, vs. spending most of my time on actually creating the content?   Ashley asks: How do I know if I'm a content creator, or just a streamer?   How do you know if you're good at what you do?",0,coarse2fine
2heyDaTfMQQx3uXnJlpR9V,"You have a strong hand, and it will be easier one day. God forbid you ever have to turn it into fiat. You never know, you never know. For the common man, and this seems kind of complicated, but who knows but read it. This will be a killer app. How the lightning network could improve encrypted messages. How it could make a big difference. I don't know how realistic it is, but I still hesitate with some of these technologies. I just know with Simplicity, it should make things easier. I'm so excited for the next 5-10 years, dude. Thank you for helping me have strong hands.",0,coarse2fine
2j9s3Qr3BS9vO5gL4nU0Ug,In this episode we talk about the importance of self-care and how it can help you grow as a person and as a human. We also talk about what it means to be a CEO and what it takes to be successful in life. We discuss what it's like to be the CEO of your own company and how you can be a better CEO. We talk about how to get out of a bad mindset and how to take care of yourself when you feel like you're not doing your best.  We also touch on how to deal with depression and anxiety and how we can all learn how to be more mindful of our mental health.,2,coarse2fine
2jNGLxgJnBBhkl6BP0dRoJ,"Effective Execution of a Company's Strategy"" is one of the most challenging aspects of a company's strategic plan. Most people come up with great ideas, great initiatives, and every year they spend countless hours, countless efforts to prepare. During creating a business plan or even set of strategic plans, they also hire very expensive consultancies to do so. But the problem is sometimes most of the effort goes to waste because they don't really put extra effort to make sure that they do have a systematic approach to follow up and follow through the strategy implementation and execution effectively. Here are the 5 steps to consider when executing a company strategy plan: Step 1. Understanding the company strategy Step 2. Visualizing the strategy Step 3. Reporting Step 4. Tracking KPI's Step 5.",2,coarse2fine
2jvWqUD1asYvFsDAFsozkZ,"In this episode, I sit down with my good friend and fellow A&R guy, Chris, and talk about his journey to where he is today. We talk about how he got his start in the music industry, what it takes to be successful in the industry, and what he's learned along the way.",3,coarse2fine
2kcfQZbfss3uBurHEOZoVN,"I have learned so much from my own O'madden Intermittent Fasting journey, and I want to share with as many people as I can.",0,coarse2fine
