Number,Summary,Score,Network
00DkMSm0fRH9TpwtvJL4N0,"This week McKenzie Fayne and Lee Fayne talk all about Teen Mom 2 Season 9 Episode 6 where Madison and Alex finally move in together, Alyssa and Chloe have a heart to heart, Alex and Juliette's relationship continues to be complicated, and Madison's family is not happy with the way things are going. Tune in! The cart comes way before the horse in the reality series """"Teen Mom 2."""" Based on the hit Danish format, """"The Real Housewives of New Jersey"""" is a reality television series that premiered on The CW on January 26, 2014. The show follows a group of young adults confronting issues of love, heartbreak, betrayal, class, and looming adulthood as they pursue their dreams and each other while living in a different state of mind. The first season was a success, but the second season was plagued by financial issues that threatened to derail the entire project. As the series wound down, the cast faced financial challenges of how to pay off student loans, buy a house, and find a way to support themselves while trying to maintain a healthy work-life balance.",1,coarse2fine
01qEmLFElBRXlHzqT0ifI9,The Northwestern Wildcats were busted for intentionally losing games to pay off gambling debts.,3,coarse2fine
020VZpYLp8NdRDibQXjpVY,"Africa Time"""" - Best Motivational Speeches Of All Time - Best African Speeches of All Time | Best Motivation Speeches In Africa | Best Inspirations Of All-Time | Most Inspirational Speech Speeches in Africa | The Most Inspiring Speeches From Africa | Top Motivators in the World | Best Speeches from the World's Most Influential Speakers on Africa | Who Are The People Who Inspire The People? | Who Inspires the People Who Lead The People In Africa? | Which Speakers Inspire the People in Africa? • Who Inspirates the People In The World? | How Do You Inspire Your People? • Which People Inspire You? • How do you inspire your people? • What are the people who inspire you? • Do you inspire the people in your life? • Are you inspired by the people you surround yourself with? • Where do you get your inspiration from? • When do you find inspiration? • Why do you feel the need to inspire others? • Is it important for you to get up and get out of bed in the morning? • Does it matter what time of the day it is? •",0,coarse2fine
02M6TWdvrauOreyDIFYKmI,"I was born with tattoos, I was born to be a fighter, I've always been a fighter and I always wanted to be in the sport of powerlifting, but I never felt like I was good enough for the sport, so I gave it a go. I started competing in the powerlifting world in 2014 and I've never looked back.  I've always had the drive and drive to be the best I can be, and I'm always looking for the next big thing. I'm a competitor and I want to do what I can to help other people to do the same. I've had a lot of people ask me how I got to where I am today and I think I'm doing a good job. I just want to share my story with you guys. I hope you enjoy this episode and if you do please give us a review and rating and subscribe to the podcast, tell all your friends and tag us in your social media posts. We'll read out the reviews and tag you in the next episode.",2,coarse2fine
04Llj5QjDot46TEDGj7lbI,"In this episode, I sit down with my good friend and fellow lawyer and human trafficking survivor, Rachael, to talk about her journey to becoming a lawyer, her experience with sex trafficking and how she was able to make amends with her family and friends.  We also talk about what it's like to be in a relationship with someone who is a sex trafficker and what it was like for her to leave her home and move across the country to work in the field of human trafficking. I hope you enjoy this episode and if you do, please give us a review and rating and subscribe to our podcast, tell all your friends and tag us in your social media posts!",3,coarse2fine
04xHi6OlXWxwnQUE66jH2i,"For this light, momentary affliction is preparing for us an eternal weight of glory beyond all comparison!"""" As we look not to the things that we are seeing, but to things that are unseen, the things we see are transient, but the things unseen are eternal!"""" So we do not lose heart.",2,coarse2fine
05EF9y109a39kdWnc4caqg,"#Fortnite #Season2 #HypeNightPlus #Ep.2 The Fortnite competitive team is calling all operatives operatives. It's time to prove your worth to the agency by climbing the ranks during this season's hype nights each Friday and Saturday between March 6th and April 25th. The top performing agents of each ghost and shadow tournament will win the following hyper-awards based on their final ranking.  The top 1% will receive 100 hype, the top 5% will get 375, the bottom 20% will be 250, and the bottom 50% will only get 300. This is a blog post from the FortNite Competitive Team called """"Hype Night Plus"".""",2,coarse2fine
00SE6vEbN1PU6OFV9anG5i,"The eyes have it"","" by Ruskin Bond, is a story about a blind girl who is taken on a train journey with her blind companion.",3,coarse2fine
05gIsdiumhzh7JjEhBELVr,"This is the last epilogue for the year, and it's a good one. We have a very special guest this week, and a very funny one at that.",1,coarse2fine
05twJsuaGpK4wyXZsWZu08,"We talk about the early days of the Phillies, the struggles of the 1990s, the early 2000s, and the current state of the game.  We also talk about our favorite moments from the 2010s and what we would do differently if we had the chance to do it all over again. It's a great conversation with one of the best baseball minds of all time, and we hope you enjoy it!  You can follow us on Twitter and Instagram @salad_podcast and check us out on Facebook at the Salad Podcast.",1,coarse2fine
06lTquWPAOVJexhZonvQCa,"This is a show where we will be discussing the creative community, not just as individuals, but also as a community.",3,coarse2fine
07y0yNc4rF8JOVDEAX7zT2,"When the person information is being collected as part of an investigation, the organization, I guess, can refuse to confirm or deny the existence of the information in response.",0,coarse2fine
00v0W2K3d8o68maX79QK2v,"The boys are back with another episode of the pod! This week, we talk about what it's like to be in a relationship with someone you don't really like, how to get out of it, and how to deal with people who don't like you. We also talk about how to be a good friend to someone who doesn't have a good relationship with you, and what to do when you're in the middle of a breakup. We hope you enjoy this episode, and if you do, please give us a review and rating and subscribe to the podcast, tell all your friends and tag us in your social media posts! We look forward to seeing you in the next episode, so make sure to follow us on social media to stay up to date with what's going on in our lives!",2,coarse2fine
081FoKeWRf8nzJi6MQFKRl,"You can't be a creative director and a sports artist at the same time. You can't have both at once. You have to be on the same page. You need to be clear on what you want to do and what you need to do to make it happen. And that's where creativity comes in. In this episode, we talk about the importance of being clear on your vision and what it means to be a good creative director.",1,coarse2fine
08RS6NQIGy9O2KyKVlCzdU,"In this episode we talk about the benefits and drawbacks of using Quito for bodybuilding and how it can be beneficial to the body. We also talk about some of the things we've noticed in our clients and what we would do differently if we could go back in time to when we first started competing. We talk about how to get the most out of Quito and the benefits it can bring to your body and how you can use it to your advantage. We touch on the importance of protein sparing and how that can be a good thing or a bad thing for your body.  We also touch on what to do if you are struggling with your diet and how to make sure you are eating the right amount of protein and not overdoing it. Lastly, we touch on some of our favorite foods and how they can help you lose fat and build muscle.",1,coarse2fine
00x6bXv5JPNTCDteN5JGlP,"Are you being authentic? Are you showing up as your best self?"""" This week we're talking all about self-care and how to show up as who you are as a human being. We talk about what it means to take care of yourself, how to be present with your family, and the importance of showing up for yourself.",2,coarse2fine
00y3rxCkHBrbY1xwqojEGR,"I don't own this content! Achievers Mindset does not own the rights to these audioclips.  They have, in accordance with fair use, been repurposed with the intent of educating and inspiring others Original video: https://www.youtube.com/watch?v=y5zY5ZY5JxDwY6Vt0s Credits: Music by Jeff Kaale (1, 2, 3, 4, 5, 6, 7, 8)    #TheReceiptsPodcast is a fun, honest podcast fronted by three girls who are willing to talk about anything and everything.",0,coarse2fine
00yoUSA2yh7eAY8t45JM91,"Welcome back to another episode of the T.I.V.E.Y.Y Podcast! In this episode, I discuss the following topics: #1. 2 Chainz & Jay-Z's beef #2.2 Chainz vs. #RocNation #3. Meek Mill #4. The #5. Jay Z vs #MeekMill #6. Lil Nas X #7. Drake vs. Kendrick Perkins #8. Eminem vs. Drake #9. Drake v. Eminem #10. Eminem v. Kanye West #11. Kanye vs. Jay-Rod #12. Jay vs. Eminem  #13. Eminem Vs. Kendrick West #14. Drake Vs. Nas #15. Nas vs. Nicki Minaj #16. Nas v. Kendrick Woods #17. Eminem VS. Drake #18. Drake VS. Nas X #19. Kendrick Wood #20. Nas Vs. Drake. #21. KendrickWood #22. Jay Rodger #23. Kendrick Allen #24. JayRodger #25. Jay Ronson #26. Kendrick Lamar #27. Eminem / Jay Z #28. Drake / Eminem #29.",0,coarse2fine
01D58jn9qXZ01y8pRQX0KZ,"From the Mount Olympus Podcast, Triple D is joined by the owner of the Lonestar Lancers, Marvin Richards. We talk about the upcoming week 3 game against the West Texas Drillers, the state of the league, and the future of the sport in Texas.",2,coarse2fine
01VLfoxXkwAXtuYGTQYrsT,"The Real Housewives Of Potomac After Show: Whose ex is next? Our hosts @rivetsoro, @itsdeliagomez and @itsmeveronica_v discuss this week's episode where we find out what happened to Paul and Karine's mom, and what is going on with Avery and Ash's relationship. They also talk about the new cast members, the new housewives, and the new look of the housewives. Tune in here for reviews, recaps and in-depth discussions of the latest episodes, as well as the insider scoop from cast and crew members on the show.   ABOUT REAL HOUSEWIVES OF POTOMAC: Real-world dramas whirl around five privileged ladies from different walks of life in this soapy entry in the 'Real Housewives' franchise. The Southern belles include a single socialite, an aspiring country singer, a successful country music star and the wife of a professional basketball player. The sassy women's entrepreneurial spirits are also in full bloom as they juggle their personal and professional lives, along with their busy personal calendars.",2,coarse2fine
1E23TJE5PZuN8hFIbiOkie,"I don't own this content! Achievers Mindset does not own the rights to these audioclips.  They have, in accordance with fair use, been repurposed with the intent of educating and inspiring others Original video: https://www.youtube.com/watch?v=y6ZwYtNxNxJxDw0l0s Credits #selfimprovement #productivity #selfgrowth #becomebetter #selfdiscipline #improveyourself #dailyhabits ------- I help people create a future they love. I went from game-addict to a life coach. I started a podcast because I wanted to share my thoughts on a variety of topics with you guys. I hope you enjoy the show. If you do, please give us a review and rating and subscribe to the podcast, tell all your friends and tag me in your social media posts so I can help you create a better future for yourself and your family.",0,coarse2fine
1EPOaWpjdUB7lB589jjTx3,"Welcome to the first episode of my podcast! In this episode, I sit down with my friend Andres and talk about our college experience and how we met. We also talk about some of our favorite moments from the past year and what we are looking forward to in the future.",1,coarse2fine
1EUY0YMsUCReAi78xtVKeU,The Psychedelic Furs' Tim Butler jumps on the phone to talk about the band's first new album since 1991's World Outside.,1,coarse2fine
1EcBqy8tM3TYInm1k8Fdbm,"In this episode of the Detroit Paranormal Exercises Podcast, we talk to paranormal investigator, Patrick Hiyo.  We talk about what it is like to be a ghostly person, how to deal with ghostly people, and what to do when you see a ghost in your own home. We also talk about some of the things we have seen and experienced in our travels.",0,coarse2fine
1EwZ9ewnlXBQ3jH5ImlY3o,"Welcome to the first episode of the Life and Football Podcast! In this episode we talk about what it is like to be a wide receiver at Wyoming, what it's like to play in the NFL, and what it takes to be successful at the next level. We also talk about the importance of family and how important it is to have a good relationship with your family. We hope you enjoy this episode and if you do please give us a review and rating and subscribe to the podcast, tell all your friends and tag us in your social media posts!",1,coarse2fine
1F4hsSqn87iEttR0rA4tRS,"I have to give to the world what I wanted. I wanted it to be the absolute best. I spent four years on the Five AM Club. I rewrote it over 50 times every line. I was mentally, physically, emotionally, spiritually exhausted. My well was empty and that's what needs to happen.",0,coarse2fine
1G02hUDmyMFk1aKts60uPC,"2019 was a hellish year for most of us, but for me, it was such a turbulent period in my life where I had to re-learn my needs, my wants, my likes, my emotions, everything that was going through my head. I was so happy that 2019 ended in such a good note and feeling good about myself. I celebrated my small victories and triumphs and also wallowed in self-pity, self-doubt and also the defeats that I experienced. But one thing I was proud of is that I was totally honest with myself with my friends and people around me about how I was feeling about my breakup, my emotional rollercoaster and how I felt about my emotions. This was a year where I learnt to love myself for who I am and what I want for myself. It was also a year of love for my friends, my family, my friends' friends and my family. This year was also the year of my love for myself and the love I had for my family and my friends. This podcast is all about the love we have for ourselves, the love for our friends, our family, our friends and all the things that could mean love for anyone.",3,coarse2fine
1GOXInXdJrluLuLywx5NzP,"The boys are back with another episode of the podcast, this time we talk about the time we got caught in the middle of the night at a bar, the time Jackass went viral on TikTok, and a few other things. We also talk about some of the craziest things we've ever been caught doing on the internet. We hope you enjoy, sit down, and have a nice drink. Thanks for listening, we really appreciate it.",1,coarse2fine
1Gcwzel68ribYC6kga7Eib,"Your thoughts are energy. They are a form of energy. Your body is in energy.  Your emotions are also energy.   Your thoughts are also an energy. In fact, even this physical body which appears to be in physical form, is essentially energy because if you break down all your tissues into tiny tiny cells, and tighten cells into small little Adam and Adam in two electrons, you will get two electrons.   What are they? They are Energies.   In this series of conversations, I am going to introduce you to the psycho-spiritual aspect of the energy. How is this series going to help you evolve in your understanding of Psycho-Spiritual Dynamics and it's correlations with your physical, emotional, social, financial and financial sense of well-being. It will also help you to bring about awareness so that you can bring about the shift in the way you live.   It is very easy to master the art of observing, modifying and amplifying your thought and that's what I'm going to teach you.",3,coarse2fine
1GjzWFb5mT9lXCgSety6VH,"The Universe will conspire to support you. On your timeline, right? Not the way you think it should work out, but I truly believe that if you can find that song within you that is yearning to be sung to you, and out of purity of heart, you'll have the courage to to manifest that in the world that I think the universe shows up to support in magical and mysterious ways you could never predict.",0,coarse2fine
1Gs0FfKfblOH4nFbIi0yIL,"Take it Easy Everybody, Bitcoin has no rigid specification. No fixed development team. No final security guarantees. No central brain, no central vision. No kings and no rulers. This is the crypto economy. It is a decentralized organism, organically evolving without central planners.",1,coarse2fine
1Hh5YXYGj7pEs9jyhYAX9c,"Welcome to the first episode of The Runner's World Podcast! In this episode, we talk about the upcoming Olympic Trials in the men's and women's marathon. We also talk about what it's like to be an athlete in the sport of track and what it takes to get to the Olympic Trials.  We are joined by two members of the Atlanta Track Club's Sprint Squad, Red and Avery. We talk about how they got to where they are now and what they are doing to prepare for the 2020 Olympic Trials, as well as what it is like to train with Craig and Eric and how they are preparing for the Olympics.   We also discuss what it was like for Red to run his first marathon and how he was able to make the Olympic team and what he is looking forward to in the 2020 Olympics. Red also talks about how he has been training with Craig since he was in high school and how it has helped him get to where he is today. Red is also a member of the track team at the Atlanta track club and is one of the best in the country at the mile and 800m.   Red is a great athlete and we are excited to have him on the show.",0,coarse2fine
1HmN1BDPrSiIdYEWTX84xz,The Mary Poppins Umbrella has the power to kill and bring back. So Matthew can bring people back to life with the umbrella. And we're only finding out about it now.,0,coarse2fine
1IGWQ2uSXK2vhwZ7wVYLBp,"TNT Tina is now available for you to start doing so that you can work towards unlocking T.T. and T.N. You need to use upgrade bench to side grade as a weapon.  You need to deal damage to bosses, 500 in total, land at the Rig, Hydro, 16, and Luck, Jack, Log Jam Woodworks. You must destroy Century Cameras without using Shields or healing items in between eliminations. The footstep audio is again present on PlayStation 4 and Xbox One. There was a problem with the audio on both platforms and it seems to be fixed. I hope you enjoy this episode of Daily Fortnite.",0,coarse2fine
1IV366QieNfHHrWKechXo0,"I'm Too Effing High"" is written and produced by James Mastreani, Mike McLendon, Matt Newell, Dhruv Uday Singh, and Andrew Steven. Executive producer Mimi O'Donnell. Senior producer Katie Pastore. Associate producer MR Daniel. Recording and engineering by Armando Serrano. Sound design by Daniel Brunelle. Mixing by Haley Shaw. Music supervision by Matthew Boll. Score by Allison Leyton-Brown.",0,coarse2fine
1IdIzNXBCtUTHLHCtq0z8F,"Welcome to the first episode of the podcast! In this episode, we talk about our week, the best songs of the week, and what we would do if we could go back in time.",0,coarse2fine
1JdBQNxOOXManwRuQkCMdl,"In this episode, we talk about our fears and how we can overcome them in our friendships. We share some of our biggest fears we've faced in our relationships and what we've learned from them. We also talk about what it means to be a good friend and what it's like to be in a friendship where you don't know what to do with your time.  We also share some stories from our own experiences with friendships and how it's helped us to see things from a different perspective.",2,coarse2fine
1JnsLxgHqv9kv21D5bhIKy,In this episode Hans and Jason talk about the clip-on thermal unit that can be used in a traditional thermal rifle scope.  They discuss the pros and cons of the thermal unit and how it can be an alternative to traditional thermal scope mountable scopes. Jason also gives his thoughts on the cost and features of the clip on thermal unit.   Check out the extra content about this episode on besthouroftheirday.com Rate/subscribe in Apple Podcasts!  https://apple.co/2SGrXJ8hRn  Episode Highlights:  1:00:00 What is clip on thermals? 2:00 Why is it important to have a thermal scope? 3:00 How expensive is it? 4:00 Is it worth it? 5:00 Should you buy one? 6:30 What is the cost? 7:00 Does it cost more? 8:30 How does it compare to other thermal scope options? 9:30 Is it a good fit for you? 10:00 Can you use it in the field? 11:30 Does it work? 12:00 Do you like it?,3,coarse2fine
1Jzr0NPKtscqfyNa08GGos,"It's hard being a stay-at-home mom, but it's even harder being a working mom. In this episode we talk about the struggles and the rewards of being a mom and how to balance work and home life. We also talk about what it's like to be in a relationship with someone you love and how that can be a blessing and a curse. We talk about how to navigate the ups and downs of the work-life balance and how you can make it work for you and your family! We also chat about the importance of family time and how important it is for us to have time for ourselves and for our kids to get to know each other.  We also share some of our favorite ways to connect with other moms and how we've been able to build our community through social media. We hope you enjoy this episode and if you do, please leave us a review and rating and subscribe to the podcast!",3,coarse2fine
1KChgOZE6wN4JVuAEXx9Ij,"You need to start practicing serving and volleying if you practice it. If you practice serving to the body, practice serving down the T to reduce angle, practice hitting a serve that helps you get the weakest return possible. You just need to have your positives outweigh the negatives in serving and volleying. I never hear people talk about the negatives by the way of serving and staying back. Here's why when players stay back there, they're super happy and they lose. They start focusing on all the mistakes that they use to not make when they stay back and they start missing high volleys. You start getting more frustrated. You've got to start winning more points, second. So please practice your service and volley. Practice being a wall at the net. When you practice being a lower ball, it'll cause you to win more points. And then when you hit a high ball, you start hitting a crosscourt shot.",0,coarse2fine
1LGiNqeMucKlN34wEBFDFJ,"The monster tyfon was often described as having 100 snake-heads upon his shoulders. Although his brain warned him of danger, many pests was inexplicably drawn to whatever hid behind the boulder. He climbed up a ledge to get a better look, but saw nothing. Suddenly, the air around him chilled and turned damp. He desperately shimmied around the boulder and immediately turned back. He did however, hear something. He felt a breath on the back of his neck, causing his knees to tremble.",0,coarse2fine
1LGrOPH2MVCMrqB18TNtWZ,"This week on The Daily Run-In, my guest is comedian, actor, writer, director, producer, and all around great person. We talk about how he got to where he is today, what it's like to be an actor, and how to get to where you want to be in your life.",0,coarse2fine
1LUAwERMFZTzF1mLwYlgWL,"Grow with the Fam"""" is a new segment of the Business Mentor Podcast. In this episode, Ronster chats with Angelo and Rupert, the owners of the Family Mart flagship store in Baguio, Philippines. Angelo talks about his journey as a franchisee and how he got started in the Franchising Industry. Rupert talks about the challenges he faced in his first year of Franchising and what he's learned along the way. Angelo also talks about how he was able to get his first Franchisee to sign on as a Franchisee. Angelo shares his experience in Franchising as well as the challenges that he faced as a Franchising Entrepreneur. Angelo is also the founder and CEO of Family Mart Philippines. He also shares how he has been able to grow his business to where he is today. Angelo and his team are looking forward to opening more Family Mart stores in the Philippines.",1,coarse2fine
1MRseMufwdMFdwf9tAdQ9F,"This episode is brought to you by Today in True Crime, a Parcast Original. For more episodes like this one, subscribe to Today In True Crime on Spotify, or wherever you listen to podcasts. On March 5th, 1972, less than 12 hours after Kim Wendy Allen's body was found on the side of Enterprise Road in Santa Rosa, California, she hitchhiked to a gas station and was murdered. Her killer was the Zodiac Killer. But who was the real killer? And how did he get away with his crimes for so long?",1,coarse2fine
1Mi90UjG91rm73qvHzcG0t,"The fed unanimously cut the fed funds rate by 50bps, citing a material change in the U.S. outlook due to the covid-19 outbreak.",1,coarse2fine
