Number,Summary,Score,Network
1Yhi0Zw6i7apBTf1YsEkck,"In this episode of the Guys Next Door Podcast, the Guys invite in the first ever Dub on the guys next door podcast. We talk about dating to marry, dating to be married, and dating to get married. We also read some of your submissions and answer some of the questions you sent in.",2,cued_speechUniv1
1ZoSdgRjZVVDrtaBpuQ3sm,"In this episode I make my predictions for the 2020 MLB season. I go over my division winners, wild card winners, and who I think will win the MVP award. I also talk about my favorite players to watch and who to watch out for in the National League and AL.",3,cued_speechUniv1
1a8X3Df0CobqJNYPB4rCab,"In this episode I talk about finishing a painting and how to know when to stop when the painting is finished. I share some of the techniques and ideas I use in my studio practice when I get to the finishing stage. This episode is brought to you by Layer by Layer, where you will see me paint a large abstract painting from start to finish.",2,cued_speechUniv1
2WhmTkmk6Pf3MzOOfGShdx,"Welcome to our first episode of the podcast! In this episode we talk about some of our first experiences and some of the things we’ve experienced so far. If you do, please leave a 5 star review and subscribe to our podcast that will really help us out!",0,cued_speechUniv1
2Xeg8BOxRCQMxQJNkRKNQg,"In this episode, we talk about how to protect your investments from the Coronavirus and how to avoid panic selling and panic buying. We also talk about the 7 ways to shield your investments and your money from the impact of the stock market and the market as a whole. This episode is part of the #OnFireTheFamily series.",3,cued_speechUniv1
2XxwpvnMErxxv1gIE7kYn4,In this quickie I talk about a statement from Brandi Love about her and her husband’s open relationship. I also talk about what the average person would pay to have sex with Brandi love and what she has to say about it.,1,cued_speechUniv1
2Y8jc5V7n6TUyF5gFXzr5C,"In this episode of the podcast I talk about the season 2 finale of Love is Blind and the first episode of The Hills season 2, episode 9. I also talk about how I got my first guest on the podcast and why I’m so obsessed with the show.",0,cued_speechUniv1
2Y9ZsvPmmCBm2ae9GbcKQF,"In this episode of Basically Growing Up, we have a guest on the podcast, Nikki Stables, a Hong Kong student in exchange in Denver, Colorado. We talk about what it's like going up on their side, the difficulties faced while coming of age, and how to deal with some of the problems we face as a young adult.",0,cued_speechUniv1
2YImecHJLfg0XXr5uqQQ0Y,"In this episode of Breakfast with the Boys we talk about weird scenarios, would you rather, the 2020 elections, and more. We also have a special guest, Vermin Supreme, and we ask the 8 ball questions to the audience.",0,cued_speechUniv1
2YhkeuIWznFXfwPIPjNpIs,"On today's episode of the Hash Rate Podcast, MeanHash and I are joined by Mr. Seth Estrada. We talk about building communities around proof of work projects, masternodes, the Prague power issue, and MeanHash has an epic rant on the inclusion of big tech into the crypto space.",0,cued_speechUniv1
2Yqc6JVpmh4x6ttfyGJmH0,"This is the first episode of the podcast about the life of a transgender. In this episode, we talk about the history of castration and castration of the transgender community in India. We also talk about how castration works and how it is done in the country and the impact on the lives of transgender.",0,cued_speechUniv1
2ZXgyKhQTtNbW0FR27AJFx,"In this episode of the first ever episode of Sisters in Conversation, I have with me, Aralia Leotard, a corporate legal counsel by profession who recently resigned from a boutique investment and asset management company based in Sandton. She is a skilled in-house legal counsel who’s day-to-day duties and through drafting and reviewing a of contracts as well as attending to any legal governance matters for the organization. She's an advocate for personal and professional development. Aralia holds a Bachelor of Laws degree and a compliance management certificate and most recently obtained a post graduate diploma in contract drafting and interpretation with an ambition to obtain her Master's in Law in Information Ecology and Communication. She’",2,cued_speechUniv1
2a1FiJixYsXIV7iiW6USsm,"Habituate is a noun meaning a frequent or habitual visitor to a place. Habitate is often used for someone who frequently visits places of recreation or amusement, such as pool rooms, bars, or used bookstores. Habitue is a habitue of art galleries.",0,cued_speechUniv1
2aTnF7mLdGbvvKfSP7I27P,"In this week's episode, Danny and Sam talk about Pro Man: Premier Man and tell you what they thought about it. We also answer a question from a patron and dive into the story of The Burning Rescue and how it came to be.",0,cued_speechUniv1
2aYfoNO3ia6i1s3k1ZhDwt,"There is nothing more hopeless than death, but Jesus can bring us through because He himself has conquered death and hopelessness and despair. He is the God we serve. Hope you’re encouraged today and that you are getting to the word yourself. Pray that this week is a fantastic one for you.",0,cued_speechUniv1
2bA3SdEDHSWpbpX4BL5TUf,Welcome to the first episode of the Canary in a Coalmine Podcast! In this episode I ramble on about a variety of topics and ramble for an hour and a half.,0,cued_speechUniv1
2bI4lMf13AufxzbyaH83vI,"In this episode of The Great Exfoliation Debate, Jessica and Natalie talk about their favorite types of exfoliators and the pros and cons of each of their favorite products. We also do a wine pairing and talk about the benefits and drawbacks of different types of chemical and physical exfoliation.",3,cued_speechUniv1
2d3xRgazp3yOhjHQcdnVgV,By now you’ve probably noticed that there have been dioceses around the United States and in the western world restricting receiving Holy Communion because of the big risk of illness right now. So that’s been of course a source of controversy and you see this all over Catholic media pages and all kinds of arguments about this. Bishop Athanasius Schneider on the same day that he released the statement that I put up of has commented on this and I didn’t choose at the time to post that one. I’m going to today because of just how important the story is.,0,cued_speechUniv1
2dm87P6iUkLd01xhNzqa02,Today's episode features Jordan Peterson discussing why we don't aim at what's best for the future. Search for the full video on YouTube. Enjoy :)  Love the Show? Want to support the creator even more? Subscribe to his podcast and let him know what you think!,1,cued_speechUniv1
2eJJmwnyOXVOc8vbkIy8El,"Considered by many experts to be the greatest mystery in aviation history, the fate of Malaysia Airlines flight 370 still remains unsolved. Through documentaries, press releases, and feature films, millions have tried to stitch together the pieces of this horrific story. In the years that followed, the Malaysian government spent over $100 million on the search and rescue of the plane. The first piece of debris was found on the shores of Madagascar in 2014. When the Malaysian Government announced this discovery, they said the piece belonged to MH370 beyond a shadow of a doubt.",0,cued_speechUniv1
2f7QjbmcaeVRCSXlWPNmkX,"In only five years, Frank Abagnale Jr. became one of America’s most ingenious con artists during his five-year career. After running away from home at 16, he survived on forged checks until he created a new identity for himself as a Pan Am pilot. After a close call with the FBI, Frank evaded capture using a slew of new identities, before returning to his roots in check forgery.",1,cued_speechUniv1
2fKv4vfiIYV0DkteofeSkI,"In this episode of Elevate Manila Philippines Talk, we discuss the power of Emotion and how to not allow it to destroy you. Emotion is God's gift and we need to learn how to use it to our advantage. We also hear a testimony of how emotion brought a woman to pain but how the Lord has inspired her from further destruction of herself.",1,cued_speechUniv1
2gViultpkndrFPEVQJ3pOK,"In this week's episode of Your Favourite Film is Awful, Luke and Charlie talk about their favourite and least favourite films of 2019, debate the winners of the AFIEA Awards and discuss the most awful films of the year. We also answer your audience submitted questions and talk about the Golden Globes and the Oscars.",3,cued_speechUniv1
2ghRFmlKIA3o7PuYDhH710,"This episode is brought to you by Villains, a Parcast Original. Albert Anastasia was a ruthless hitman and crime lord. By the end of the 1920s, he was one of the most feared mobsters inside and outside the criminal underworld.",1,cued_speechUniv1
2h6p8z3CLHzkbRGX2hI5B8,"He was a man whose arrogance could turn people off, and yet as the third head teacher for Stoicism, one of the main competing philosophies in ancient Greece, his influence continues to touch our lives today. Chrysippus of Soli was a Greek philosopher whose ideas still resonate today. It is said that he died laughing. But is that really what happened to the Stoic thinker?",0,cued_speechUniv1
2hQUxoBiju6vmoltsNn23b,"In this episode of Ask Ashley, we answer more of your questions about what you should know about YouTube content creation and how to get discovered on YouTube. We also talk about the importance of being a storyteller and how you can integrate that into your YouTube videos to increase your discoverability.",3,cued_speechUniv1
2heyDaTfMQQx3uXnJlpR9V,"This week in Bitcoin we talk about the most popular Samurai Whirlpool month of all time, a power company is mining Bitcoin every day, the Lightning Network could be a killer app, Bitcoin taxes are the worst nightmare, South Korea makes Bitcoin legal, and more! Recorded in Baltimore, MD!",1,cued_speechUniv1
2j9s3Qr3BS9vO5gL4nU0Ug,Welcome to our first episode of We're Not There Yet! In this episode we introduce ourselves and talk about who we are and what we want to bring to this podcast.,0,cued_speechUniv1
2jNGLxgJnBBhkl6BP0dRoJ,"Many people come up with great ideas, great strategies, great initiatives and every year they spent countless hours countless efforts of preparing during creating recreating the business plan, business plan or even set of strategic plans and sometimes they also hire very expensive consultants to do so. But the problem is sometimes most of the effort goes to waste because they don’t really put extra effort to make sure that they do have a systematic approach to follow up, follow through and follow through the strategy implementation and execution effectively.",1,cued_speechUniv1
2jvWqUD1asYvFsDAFsozkZ,"This week on the Inside Podcast we have Eric McClellan, former A&R at Warner Music Group and current founder of management and artist development company, Yo Peep This. He gave us 40 minutes of his time to cover some solid tips and tricks for artists that are just starting out and how they can A/R their own projects but also as they start to progress in their career how to start to reach out to bigger and bigger labels and work with labels as well. Eric is a great guy and an avid baseball fan.",2,cued_speechUniv1
2kcfQZbfss3uBurHEOZoVN,"This week I’m talking all about extended fasts! What you need to know before you start one, how to hang in there and not quit while you’re on your extended fast, and most importantly how to break and extend it. This is an important topic because there are some misconceptions about extended fasting that I want to clear up.",2,cued_speechUniv1
2kyirVCVfkv05DQF6K9ZnQ,"Millennials get a bad reputation for everything they do. They get blamed for killing the mayonnaise industry, the diamond industry, and even the divorce rate. Myths and stereotypes follow every generation, and none of them are immune from job hopping. Here are a few common ones and how to combat them.",1,cued_speechUniv1
2lDhCSrdibSvo0Fuqd5Qz4,"A bedtime story by Edgar Allan Poe about a black cat and the events that lead up to his murder of his wife and the death of his beloved pet cat. To be read, close your eyes and relax as I read you a story to sent you to sleep. Sweet dreams.",2,cued_speechUniv1
2o7WrExn5YSqJEh8KBuxeB,"In this episode we talk about Pisces season, the Full Moon in Virgo, and some of our favorite places in Pisces. We also read a poem by one of Lisa's favorite poets, Christina Rossetti, and talk about how the moon is in the sign of Pisces and how it affects our lives.",2,cued_speechUniv1
2oc3ofJDxmI2nLlNYhJHvN,"In this episode of Unplugged, I have my first guest, Katie, and we talk about self-love and self-care. We talk about the importance of self-awareness and how to love yourself before you can love anyone else. We also talk about how to declutter and declutter your life so you can focus on the things that make you happy and the people in your life.",2,cued_speechUniv1
2qCQkhxRORy9GZ31iRCIqC,Make promises only when you mean them! Alex Sheen is the founder of the non-profit Because I Said I Would. In this interview we talk about how we make promises every day just by saying yes and how dangerous that is for the relationships and expectations around us. You won't want to miss the interview!,3,cued_speechUniv1
3tzoElYoixtgMaTJ1FiZad,"In the first episode of season one of the Third Imperium Podcast, the Death Saving Gang begins their journey on the Tenderfoot, a subsidized Captain by mail ship. This is the first ever episode of the 3rd Imperium podcast, and we start off at the Spaceport at Zemus, the capital of the Concordia sub sector of space.",1,cued_speechUniv1
3u57dQEUl7W1YTCwQQTM6e,In this episode I talk about the case of Gabriel Fernandez and the trials of Pearl and her boyfriend. I also talk about two other child abuse cases and my own experience with child abuse growing up in my household. This is a sensitive topic so if you don’t want to listen to this please listen with caution.,1,cued_speechUniv1
3uXxGkvtfq74gZ3Uh4KiZx,"In this episode of the Dallas and Show, I sit down with my girlfriend Liana and we talk about how we met, why people cry at weddings, and why Liana's boyfriend is a douchebag. We also talk about the Impractical Jokers movie and how Liana almost got her ass kicked by one of the characters.",1,cued_speechUniv1
3vT0kFkz2Gz8RDLJH3knzx,"Welcome to our first ever episode of Do This In The 2020s! In this episode we talk about the importance of celebrating women, feminism and the highs and lows of doing your 20’s in the 2020s. We also talk about some of the women in our lives who have inspired us throughout our lives and what it means to be a feminist.",2,cued_speechUniv1
3vaqb9E0J8466F8J4UeDyE,"Spoiler alert, I’m doing some definite speculating on today’s show! So tune out if you want to stay spoiler-free on Bachelor this season. A couple weeks ago, I reported that Madison Pruitt was seen in Auburn filming something with a production crew. And I along with almost all of Bachelor Nation speculated that Maddie was certainly going to be the 2020 Bachelorette. Well, that theory is officially dead because Claire Crawley was announced as next season‘s leading woman.",1,cued_speechUniv1
3wF2WxFD1Z9h6o01vnvs9q,"Interview with John Rudd who is a National Performance Director at Swimming Ireland. We speak to John about his career at Plymouth, some of the athletes he coaches at Plymouth and a little bit about what he is expecting from Ireland at the 2020 Olympic Games in Tokyo with Island Swimming.",2,cued_speechUniv1
3wSzVvzB53WyFg5DKxrK0l,"On this episode of Nintendo Cartridge Society, Patrick and Mark talk about the news from the past week, the third anniversary of the Nintendo Switch, and the release of Shovel Knight: Spectrum of Torment. They also discuss the Platinum Games and Yacht Club news, and Patrick shares his 2020 Pokemon of the Year.",1,cued_speechUniv1
3xNSneHkYqNyGDVgz5NKAl,"Tonight we're learning about Wangari Maathai, the woman who started the Greenbelt Movement. Wangari is tonight's Chompers Heroine for her tireless efforts to help the environment and the women of A LOT of Africa. Shout out to Wangari for being tonight's Heroine!",2,cued_speechUniv1
3xwXYI4A79TXcrFmMwRGV1,"In this episode of the Purple Monkey Podcast, the boys talk about the most packed episode we've ever had, Harvey Weinstein's trial, Unbirth, and the best and worst episodes of the week. We also introduce a new segment, and talk about our favorite and least favorite podcasts.",1,cued_speechUniv1
3yQa1EAhglPH87xqtfQKmo,Coach Corey Wayne discusses how to find your purpose in life and how to overcome the day to day struggles of not knowing what you want to do with your life. In this video coaching newsletter I answer an email from a man who knows what he wants to do in life but is struggling to find the right path.,2,cued_speechUniv1
3yveWKAwSF6rONBwHtikMC,"In this episode, I interview Had Girl Izzie Wilson about time management and how she does it. She talks about how she manages her time between A Level and GCSE work, how to plan her meetings with Mr Miller twice a week and the importance of being nice to other people.",1,cued_speechUniv1
3z5zWuMnniPKcTPymHRRXI,"It looks like there's going to be a Lady Loki in the upcoming Disney+ series! Are you excited about the upcoming series? Let us know what you'd like to see in the comments and subscribe for your daily dose of Marvel! For more in-depth conversations, head over to Marvel Movie News on the Popcorn Talk, Thursday's 1pm PT.",1,cued_speechUniv1
3z9Kkk9LNEH2TGkilqcPFr,"In this week's special, Gage is joined by Chris Miller, better known as Windy, to discuss all things Tottenham Hotspur. We talk all things Spurs, from Josie Marino, the youth system, the academy, and the future of the club.",2,cued_speechUniv1
3zir6jx2t64H9gzWjg4ac0,In this episode I sit down with my friend Corey and talk about polyamory and dating preferences. We talk about the pros and cons of being polyamorous and the stigmas around this kind of relationship. We also talk about dating preferences and the benefits and disadvantages of dating with more than one person.,2,cued_speechUniv1
3zkN09hDZfoEeX6IfVNbvA,"Though the origin story of the Jersey Devil has many variations, the central narrative remains the same: a pregnant woman, referred to as “Mother Leeds,” shouts the words “The Jersey Devil.” The monster was originally called the “Leads Devil” before becoming known as The Jersey Devil, and as it turns out, Mother Leeds may have actually existed.",1,cued_speechUniv1
40cQ1OZKNp9XhUTHa92mdK,"In the first episode of After Credits, Maggie and Bryce watch the 2005/2006 classic Hoodwinked and answer questions from listeners. They also talk about Kanye West and the Maroon 5 song, ""Yeehaw.""",2,cued_speechUniv1
40dECDdVVUcaV5Pq5Xlmye,"In this episode of Sex and the Gritty, we sit in the hot seat with BMO 2020 and SVP of SVP’s EVP label, King BMO. We play a game of “Too sexy or too pretty” and talk about the hottest topics in the music industry. We also get to know BMO and his manager and how they met.",1,cued_speechUniv1
412MQ05nzDPeMOgXkULk8X,Welcome to the first episode of my podcast that has no name! In this episode I will be talking about what this podcast is going to be about and what I am going to talk about. I am so excited to get this podcast started and I hope you will join me for the ride!,1,cued_speechUniv1
41Tvys3MKcIU0cPNU7eP5w,"In this episode I talk about Tom Brady staying in the NFL, Mookie Betts, upcoming superhero movies, and the future of the MCU. I also talk about my plans for this podcast going forward and what I would love to have on the podcast.",1,cued_speechUniv1
42PU8079HT7DvGmUwkDkKj,"In this episode we take a look at Romans 1:21-21 and learn how to set our mind on the spirit to obtain life in peace. Romans 1 is jam-packed with theology and interesting thoughts, and the book of Romans is no different. Today we look at how to be people who honor God as God, and how to put Jesus first in our thoughts.",1,cued_speechUniv1
434ngZNf4auA40eI0ZFjaU,"In this episode of Officially Unofficial, Bianca and Nat talk about the laws of attraction and whether or not they're hot or are you just desperate. We also discuss ways to avoid wasting your time on people you don't think are your type and why you shouldn't waste your time with someone you think is your type.",1,cued_speechUniv1
43eFYhQOHILCTAi6Afo12F,"In the first episode of March Madness From Soup to Nuts, we dive into the biggest month of the year for college basketball. We talk with Arizona State head coach Bobby Hurley, Creighton sharpshooter Mitch Balakn and Meramec head coach Joey Gallo, and give you some late-night snacks and Nuggets.",2,cued_speechUniv1
44CnUZ2v4d6IWR1juH2I2F,"The Bible is full of wise advice on how to handle and how to view money. In fact, money is mentioned hundreds of times in the Bible, including the verse from Proverbs 13:11. Wealth from get rich quick schemes quickly disappears, but from hard work grows over time.",1,cued_speechUniv1
44iIxNU8wzmvoAgxMrPpuj,"In this episode of Premium ASMR, I talk about the joy of ASMR and how it’s the best way to get in the mood for ASMR. I also talk about how to get into the ASMR mood and how to make a S'more.",0,cued_speechUniv1
452Ytn5Dn0blMW5ZvtoJud,"In this episode of Fitness Unfiltered we are joined by Dr David Robert Grimes to discuss the anti-vaxxer movement and the role of critical thought in a day and age where we are faced with times of information overwhelm. Dr Grimes is a physicist, cancer researcher, award-winning science writer and author of a best-selling book. We explore what’s becoming growing and concerning the anti vaccine movement and some of the reasons why there is some hesitancy out there with parents and when it comes to vaccinating their children.",1,cued_speechUniv1
45aQVnTm5m78jAo856S6Qq,"Bible Reading at Bedtime - Daniel Chapter 7 - Daniel’s Vision of the Four Beasts and the Time of Wrath. In the first year of King Belshazzar of Babylon, Daniel had a dream with visions in his mind and he wrote down the dream and he was lying in his bed.",1,cued_speechUniv1
45d1oaUGzLSiAF4t93e6Th,Critical Thinking or how above is really below. To be able to doubt the most fundamental coordinates of the agreed system of coordinates of our solar system. How should I be looking up? Should up be up from the circling of the solar system or should you actually be looking down from the spin of our galaxy?,0,cued_speechUniv1
45hMVOlYDHoX0E92qKjKTW,"Control is the whirlwind wrapped in a puzzle. Words are the pieces and your mouth the muzzle bumping. Your heart seemed safer - thin like paper rolls, like this old sharpened like a fossil. Whittled like a stick. Crusty like a crinkled stick rhubarb crumble, sweet and thick Mercury disc, bite like allergen, opaque like a curtain, speckle like a freckle, tested like a medal. You had five masks, ten percent polyester, use your best friend as a tester, ten linen, 10 linen. You kept this one locked away, hidden, and rib knit 7 to 10, just a kid.",0,cued_speechUniv1
5CccnoO1WGVrT8YSiv3UnP,"In this episode, we look at 5 simple things you can do in 5 minutes per day to start changing your life. This episode is for the person who wants to take a leap of faith and start making progress, right? They want to start moving forward, they want to find some path to getting the things they’ve always wanted to accomplish, and if that is you, this episode is going to help massively.",2,cued_speechUniv1
5Ckw5dkJzTMTtrRKGEjjFh,Coach Corey Wayne discusses what women are attracted to in men. In other words what are the things that women like about us guys? So what kind of behavior is it that they like so we can exhibit this kind of behaviour to attract women? This is the topic of this video coaching newsletter.,2,cued_speechUniv1
5D5PIp1SQGtTtSNIcHwtaC,"Welcome to the first ever sleepy time podcast with your host, Rose Gold! In this episode we will be doing some quick meditation to help you fall asleep faster and feel more at peace.",2,cued_speechUniv1
5E4itTs5AlfJkb2ifEhBNT,"In this week's episode, we talk about what we've found out about the show since the finale and what we want to see going into the second season of the show. We talk about Damien's job, Kelly's new job, and how we're looking for a career path in the entertainment industry. We also talk about the reunions and what to expect from the show going forward.",1,cued_speechUniv1
5ElN9C6dXkxIDsJmo8AlA3,"Welcome to the first episode of The Valley Boys Podcast! In this episode we talk about the NFL Draft, Tom Brady, Tony Romo, and the Coronavirus. We hope you enjoy and come back by episode 5 to hear our thoughts on some of the topics we cover.",3,cued_speechUniv1
5EolNUtoexjBBAoVj5Ppy0,"In this meditation I will be sending healing energy to the Blue River in China. This river starts in the mountains of Tibet and moves through the China all the way to the East China Sea. Many people in China rely on this river for their drinking water and to help those who need it to heal the water in their body. There are three major rivers moving through China, the Yellow River, the Blue river and the Pearl River. The Blue River passes the city of Urumqi and is one of the three main rivers that passes through China.",1,cued_speechUniv1
5FwQJAdYq60tn39tfqJDTC,"In this episode of Hurdle, I sit down with meditation teacher and author of “Don’t Hate, Meditate,” Megan Monahan to talk about how meditation has positively influenced her in so many ways and really enabled her to forgive her father, who struggled with alcoholism. We highlight everything from meditation strategies to incorporate meditation into your life, debunk myths about what meditation is vs what it isn‘t, and also dive into both our personal relationships with therapy and how it has positively impacted us for the better.",3,cued_speechUniv1
