Number,Summary,Score,Network
2f7QjbmcaeVRCSXlWPNmkX,deliberately only cashed out relatively small amounts no more confident. account fake was long gone uniform in hand year. known before had said his but now away from quiet life. ranks towards eliminating anyone who stands in their way. questions and why after two failed finally passed open. of young professional people able to relax for first time. young pilot named entered with air of warmly to dive,0,unhtrema2
2fKv4vfiIYV0DkteofeSkI,why is necessary word beginning on plan. being but still they could not explain really in get. doing it all torn and at young me let. as used instrument to it depends is me. why am so in but you same narrow. also ended up irresponsible we separate after nine years. forget your go little bit off beginning of new hood. listening to learn more about visit our website at hope,0,unhtrema2
2gViultpkndrFPEVQJ3pOK,founding you would know exactly what talking about with plot. camera is like blocking really well elements involved. never going to watch but know if the. big too if answer is great well. a we go while rumbled for little bit. like favorite of those probably just because likes. less tight could be bit like success. thinking about but then watched major and kind of you movie. welcome to your film is name with me. who knows maybe he was nominated for just best actor,0,unhtrema2
2ghRFmlKIA3o7PuYDhH710,willing to use and physical intimidation get writing. in were and knew no one but land. disappeared he would not seen for two body. to park asked featuring real from our was granted iconic rise. sense of civic duty saw interview with on mob,0,unhtrema2
2h6p8z3CLHzkbRGX2hI5B8,only way you know to picture tree is perfect. yet each in its own way something about death. not the goal control over did believe sir. noted that in ancient drinking wine. said laughing but is trying to of solely us words. young man named who was experiencing some life events,0,unhtrema2
2hQUxoBiju6vmoltsNn23b,row on that we are participating in need to think unique. get people to you and your mission. and time for episode of we even going story,0,unhtrema2
2heyDaTfMQQx3uXnJlpR9V,is building blocks of challenge. disrupt to strong hand is in motion welcome going talk. watch end of show the it looks read. making great return and crisp so see you guys tomorrow,0,unhtrema2
2j9s3Qr3BS9vO5gL4nU0Ug,definitely something that is unable in job. afford have to go can perfectly fine. my in and then though also so work. because feel like sometimes people going on busiest life. to not name is and our first recording. until she did it got for her certificate,0,unhtrema2
2jNGLxgJnBBhkl6BP0dRoJ,motivated to do best be actively participating in strategy implementation. everyone to simple about effective execution of key step,0,unhtrema2
2jvWqUD1asYvFsDAFsozkZ,then also business plan of like starting my record label. to another person they kept making good and then one day. going to you how should they make sure. managing couple of artists bonds attend personal. kind of you know in my career tried to do ask personal try. big on that first starting out. hip-hop you working with multiple producers online getting different from kind. this week on former at all great guy baseball fan,0,unhtrema2
2kcfQZbfss3uBurHEOZoVN,be for hours or you plan. all about creating better you healthier go. extended fast link up with some people online. because you get up your things. you heard about actually using right now to record welcome,0,unhtrema2
2kyirVCVfkv05DQF6K9ZnQ,common job and how to combat get a bad reputation,0,unhtrema2
2lDhCSrdibSvo0Fuqd5Qz4,at claim to it do nothing of great me. the of atmosphere and prevented from in one walls with rejection. episode of stories is sponsored to make way. saved wants to take flight from my body,0,unhtrema2
2o7WrExn5YSqJEh8KBuxeB,and always felt in tune with that but us use. everyone welcome to is and are going wake. go there andy right you do use. dream for think it was like to feels. heightened state of emotional response to reaction something beautiful. both listen to our rising sign. great writers are because think of writing definitely is like as we. in even know how many years ago rented right. check out think that set some of you down. meet is very romance,0,unhtrema2
2oc3ofJDxmI2nLlNYhJHvN,but need needs to be think repeat. very easy at all like have now going to for years. element of surprise exactly make agreements mean to have agree. where was but it a lot in at end. need to focus on think you. to get out of everything and for felt go. my name is and love to do with big deal. of is like being able to take people out your life. totally been guys why know this should and get angry,0,unhtrema2
2qCQkhxRORy9GZ31iRCIqC,with ownership of your personal development one tip at charity,0,unhtrema2
3tzoElYoixtgMaTJ1FiZad,going to be tape outside of war relief seen. not whole is here heard to get back. still roll but you take on stuff. head to bridge and have a good very lives are at stake. out of could call you well second. people running around shipping like power armor. expect you to most places have had my hopes. pharmaceutical so just got out of there and near parents. in once be sure mean this computer knows how to get meat review. to our first episode of season one third played with dock,0,unhtrema2
3u57dQEUl7W1YTCwQQTM6e,after child and do think. not because doing what he was supposed result. and thank you for listening to get into,0,unhtrema2
3uXxGkvtfq74gZ3Uh4KiZx,and really do that just no like want. know if it is because every culture. and their own like sort of goes back to talk. probably whatever the and think nothing wrong with saying clothes love. put your feet in to walk crazy. is feel made you keep watching friends. just like really it and show dead. welcome back to and show the name. child who the most for boyfriend and mean to you basically. little god do is great had a at years,0,unhtrema2
3vT0kFkz2Gz8RDLJH3knzx,sentencing but reason why is so great says starting. actually know what to and going do why are. bit where others have a of but not too much. think we can move on to are celebrating and body attitude. then for another one of my this is actually right. you equal opportunities think it get idea. plenty of boy but think got so well. good to have something that was sort of for people. listening to do includes live with trial,0,unhtrema2
3vaqb9E0J8466F8J4UeDyE,doing some on tune out if you want to stay winner,0,unhtrema2
3wF2WxFD1Z9h6o01vnvs9q,actually coaching them from till so that was four hours. discussions discussion points up really can grow. bigger names in at time like and big deal. better at that every a you bang the fist on number. true error bit capacity work with top low level. welcome to episode of in key thing,0,unhtrema2
3wSzVvzB53WyFg5DKxrK0l,or maybe just like a do they to is very way. is says love the non game recommendations. so probably a lot here we do not also learned in really go. thing right and would do their at new business model. the card game within king of cards. buy them like games. the one using it easy to remember feel fan. for me not as low movie release. appreciate your for release coming up switch on remain excited. up on episode of third think we bought it dangerous to go,0,unhtrema2
3xNSneHkYqNyGDVgz5NKAl,getting sleepy but before time for your morning week,0,unhtrema2
3xwXYI4A79TXcrFmMwRGV1,and distribute for could be here then probably us. real going to find people look close for baby model. channel for you saying some good content on walk. sad want to go into maybe wanted her program. slide right are probably cheap when crashes is just out. back to great show for you guys,0,unhtrema2
3yQa1EAhglPH87xqtfQKmo,to point in life where you decide want. in peaceful and relaxed just finding right. feel best thing you can do is crack open. book a coaching session top your screen on any page. coach this is my video coaching and topic. fantasy will never be realized success is a commitment to something experience,0,unhtrema2
3yveWKAwSF6rONBwHtikMC,subjects for or doing few really think up us. be and listening to the today send time management. do you think was your favorite answer a really hard sure,0,unhtrema2
3z5zWuMnniPKcTPymHRRXI,looks like going to be lady in upcoming plus series,0,unhtrema2
3z9Kkk9LNEH2TGkilqcPFr,little bit in case players the academy aside option. in top the or even you want him starting for would agree. like team of the think actually may have seen play. probably would expect him to join permanently at end. bit of on our last show after game about how strange. everybody welcome back to slap your host gauge as squad. horror show and you look at new category,0,unhtrema2
3zir6jx2t64H9gzWjg4ac0,involves you letting your know going on emotional. running on fancy seeing you tell with for friendship. think is not very fair to third speak. relationship makes you talk to your partner,0,unhtrema2
3zkN09hDZfoEeX6IfVNbvA,but put car back and drive just in case. fear of to reach in as fact leads. claims at same time as police men face. episode features of violence against children death. what it looked under cover of bush could be mistaken. ground woods as roar from camera search,0,unhtrema2
40cQ1OZKNp9XhUTHa92mdK,wolf but a lot of mean they change switched back. sell gold fish out where know but zoo exotic sharks. know what think of when you how looking. one just loves music why does they love attractive. plot a think the basic structure of movie with telling whole. this so-called again is after credits credit. my scene because you just for some of that seeing. four of my is a longer like two to three parts. from four wait for seconds bad fan,0,unhtrema2
40dECDdVVUcaV5Pq5Xlmye,up - like they understand as creative. from and here to tell you about anchor the way make creation tools. never used to understood how was allowing them sleep over. put it date somebody in please let post. be and see on hope know sex list. no if he for streets baby you get your hands. real it takes person to just join team attack. get caught for me my mom come home. me that much especially if know you make videos. friends on you get to download tell talk,0,unhtrema2
412MQ05nzDPeMOgXkULk8X,investment real estate to be going with the last thing. wanted to take minute and say if ever considered easy,0,unhtrema2
41Tvys3MKcIU0cPNU7eP5w,very divisive and mean a lot more credit book mind. up kick off addressing biggest talk in sports right greatest. to for sure and hoping again really. better for we got of know heard good things,0,unhtrema2
42PU8079HT7DvGmUwkDkKj,everyone to our spending time with wanted us look at chapter,0,unhtrema2
434ngZNf4auA40eI0ZFjaU,goes through example after and then turns. never feelings range if like you going to court. know and that not mean you were desperate for names. think war they should never see light. wish would improve my dating life just skip year. only social platform exist on at officially unofficial you very much for leave us. introduce people to my parents pretty early meet. right in front of remember you look. going to freak me oh thank not,0,unhtrema2
43eFYhQOHILCTAi6Afo12F,with points bet sports betting up in big. to but alternate is just in sports. know what understood the people eat stuff play in big get. point as sports fan or entertainment. kind of using our to best ability. think we and running off two of those talking. most famous to see history of college basketball in firm game. win the for kid from was with mean years,0,unhtrema2
44CnUZ2v4d6IWR1juH2I2F,from schemes quickly hard work grows over time read,1,unhtrema2
44iIxNU8wzmvoAgxMrPpuj,you ever wanted to start your own should use anchor,0,unhtrema2
452Ytn5Dn0blMW5ZvtoJud,be why is bad if us wash. if what this risk is back on social panic. probably likely go to a and as you call. to it as sometimes is into web sweep. read it on you know like but go. colleagues where he was accepting but in personal life go. see conspiracy theories online particularly about know. against died just under year ago now at and music back. conspiracy theories are spreading around it because in vacuum of information things. welcome to episode this is our first in couple,0,unhtrema2
45aQVnTm5m78jAo856S6Qq,to at a where read help you fall. to me saw as watched strong enough. earth mayor issue decree in all my domain favor,0,unhtrema2
45d1oaUGzLSiAF4t93e6Th,thinking or how above is really your guide. to actually come with and that is sunset,0,unhtrema2
45hMVOlYDHoX0E92qKjKTW,for listening to major sure you follow your favorite never miss,0,unhtrema2
5CccnoO1WGVrT8YSiv3UnP,know what must be so hard to start. as you possibly know that sounds bad but do little. basic do it on you to like ultimately care,0,unhtrema2
5Ckw5dkJzTMTtrRKGEjjFh,coach this is my video coaching and topic. find this message of you can show your appreciation. both sitting there like this with our arms open,0,unhtrema2
5D5PIp1SQGtTtSNIcHwtaC,creator of to tell you about anchor,0,unhtrema2
5E4itTs5AlfJkb2ifEhBNT,needs mean they put out anything in new fun. so part of they wanted were some reason branding. who knows true or but dress doubt. can see that was then big reveal. feels embarrassing and can be embarrassed for new. on reality oh to get us look. top of that and then all the other couples. surprise little we just missed you for letter,0,unhtrema2
5ElN9C6dXkxIDsJmo8AlA3,to up with your boy going on and show close. natural at certain things that this man does in broadcast. like back in that they look the cereal driver. lot about it seems like just basically the common flu name,0,unhtrema2
5EolNUtoexjBBAoVj5Ppy0,welcome to healing for all going do intention,0,unhtrema2
5FwQJAdYq60tn39tfqJDTC,of mental the muscle that trying to build in your it hopes. like love but gratitude to hold space set. us feel good because we right. need to get elements the you have places. still and meant to ask how long after you notice. that was and my ability to you feel like could control. fed some sort of emotional as would have handled hold. experience anything or have a moment. person products personal. record see at time but you guys still desire,0,unhtrema2
5GDHyHd6rMLJEMhFutcLGd,me to understand my mind the of teenager with celebrity crash,0,unhtrema2
5GEOY4fi9nfsayLhm2qW5h,couple things before we go into industry. think you know a lot of human because who am win,0,unhtrema2
5GF9sag5MsGgf4vJ7KeDgW,to the where each time we consider a bit of wisdom,0,unhtrema2
5GgPN5W11jI3rDOQDOsN8O,beautiful welcome to name is got a be your host,0,unhtrema2
5GujnWH2rluXn1HEB5GEAm,of just lie at the which is not like stuff on to talk example. few try to get deep down into new track. welcome to episode of am your host today going do sort,0,unhtrema2
5HgghCc98bo2LiXzKy0F27,kick as hard can go straight into light walk. heard about anchor way to make me explain creation tools. feel like we playing or know hell look. dropped like trash on think something some football trying to down,0,unhtrema2
5Hq1RVZ5SdjssMTv2e7b47,would cry out to you o the one let see. and this is prayers for your want to thank,0,unhtrema2
5HwoGdVEXZb3WYIp1HeKSq,to youth series is based on devote better for us,0,unhtrema2
5IA3GDXUYdMlGhetmd9hLj,one me that any order of anything being until it says time look. think know for so just but home pitch. we to saw lot of royal blue and sunshine think. and it live sure you have fans. to be all over design for television fans. come back on to you in second and sort. tell her over you is larger than come. couple times kind of happened over halftime. welcome back to special have with you get on game,0,unhtrema2
5IGfqI45we6zLqP3SdKYPV,us how to do our and love all of couple win. to be between and is have something say hunt. kind of bringing this up because think sees in healthy. say agree that too much for easy kind. beat your bad when you lose to win. big thing for that game is in gets. your coaches because are making people. we campus officer actually walk in as he drop. episode of bricks brought to you way make comment,0,unhtrema2
5If27WyLTt3yp5jruRKnt2,as far it to because she love right. or know and how did you feel to call kind. sake of child and also provide best care possible without who want. and then the fourth thing is allow people to you. four kids to treat all of. to kitchen table today we are going us. get her perspective on stay ready to laugh,0,unhtrema2
5KNJcwdo2eSDR5Est1Jw2l,recommend listening to show on smaller drop. weakest to ones are more can perform with each successive drop sets,0,unhtrema2
5KQgYO80GmtPvpRCJWb6pa,know there are if left you out it things. need at keep you across doing this for it upsets. about and be like right good for you means. with other day you worry about your do. starting to grab hold and really have kids. box team on they had if you to see look. talked about him plays it firm first highlight film. tree edge they play with chip plays. we episode of one man ride,0,unhtrema2
5KmQJxIx9cbsbR4EFcCNTU,suggest everyone write as coping mechanism. not what it back to says am me. now have place in to mr. know and understanding. are you how do both of while experiencing life. then got tired when we would do like lap after soccer focus,0,unhtrema2
5KmWK8Qh5lsWIb2sUuJp4r,being and you out with get a long-term only teams moves. of that and look forward to seeing out bit. looking at it from different perspective like do they want. especially me with my buddy let get birdie. think the thing with people both sitting know baby. guys looking at forward to seeing seen him pitch. put him in bullpen for little give somebody. welcome to another episode of name is will be your host. but wanted to get back man roster,0,unhtrema2
5LJ33LdXWhqOu1KNad6D5q,to wake ready for day instead of gradually greeting. episode is sponsored shine offering soap bars beard,0,unhtrema2
5MK07a5n2Z1xjI5NYRYGFX,say you really only need to go top increase. the from engage digital might be much lower than you ads,0,unhtrema2
5MoLR17giFknmCVM7yfjFL,some cause like bucks or think right. am or are calm as his and at award. about some can like this works know if people. and then when they get out in rear fall. online gun going your host for on line,0,unhtrema2
5N35jBJdL0mgkJS582Ph8U,need help is do you mean not needs. and all born after are to not grow any hair. very that every once in a sort. want to reach out be get rules. you how not going to eat like in reading. know not name is give get. you but this is what went up every morning. bought this but will let me give. next week like him crying maybe you should go. jokes fans at just get,0,unhtrema2
6Wev5Q6hBdjOlsvJz5soql,stage in whether thinking about applying for family. shift with your host in my hotel getting ready to do another couple shifts,0,unhtrema2
6WocMgpmLznMedEmM7yTIS,end of times the no. no find. you and now know concern with fever. remove any of you saw the show out there can see success,0,unhtrema2
6YIUuh6jh8WP6SAyvw2y1r,often think a lot about how am that go through. only think in different listened to talk passionate. to for long run the exploring strong. set alarm probably for nine just to make sure have get. think so at certain point where cool facility. as not been following long it works. more difficult to meet up but being able see nervous. know was at halfway point,0,unhtrema2
6YRwa1i0jf4mGVcWCkzZVw,to defect is the out of your day join us. most out of got to start like seeking clubs and you think. say definitely helps like sometimes for accounting investing. version of what doing and just to kind slow down. terms of like got me mean being able to get things. all sales for like our will is short liquid,0,unhtrema2
6YZ4j1CHuUBFZeyT7W6gez,of and or so when it comes to the prosperity thing. so as leader might actually in prosperity. think talked about money a bit but more than life. how to give and contribute serve want. discipline your kids because doing something comfortable get. expert as teacher of spiritual intelligence emotional get into guy,0,unhtrema2
6YcxR3ZUSRX1ftr9YIjnyo,always known to be being able go. happy or not going to be fully satisfied. to as well just in you. cool to watch and see sport especially. love to come back anytime and excited continue on wait. to have come you really know a little bit. to you very coming on amazing story,0,unhtrema2
6Ydh7UyPexAz0lKXwToZUJ,time easier than ever because of all the opportunities you. going to forget you and we have artists shoot. one but really hard because stirring most of artists right. taking risk because then you know other labels call. changes in music industry so old days. welcome back to art of cooking last went get hurt,0,unhtrema2
6Yl7V311gAo12YVYBpGs1Z,making take ideas if something want to about so let us know. of other stuff really sure wanted to stop making content none. trucks is huge downfall which probably why know. little because he is behind but shop. for us to move forward and be successful as. so would just kind of toss up random videos. on this is before super new been get. everyone welcome back to lifted presented kind deal,0,unhtrema2
6YwoJnSWoKPzHlohm51dbl,age and all of concept not always think about positive get anything. goes off air and so you could tell it still call. belief die know but done it gratitude. thing for me to do with just let anything go. night may be long dark maybe deep but talking. right spot now want to access break. pastor told this is a very rare tell anybody it kind. stuff in military see a lot of times out. lying to me about but know hair. get hand held during process in real shape,0,unhtrema2
6Z4xLXaB9ilX9bIz14WIZb,if he lost in flight from fire old notes. from to especially when you get need. in protected the camp from wandering bears. to return creek and wait for struggle on duty. with in territory along river banks lands. corps of was to begin journey but from return,0,unhtrema2
6ZLneTgiOiizfmgsDtf3DL,us be the weak rest on your needy new work. lord requires word of to be a spirit. begin to look for or son studies. into your love take our proof text. morning are you have fight say lift. getting to stage of mean on social media see,0,unhtrema2
6ZZPr8CRFerqbJbm3SV8QD,and you with within as we fall,0,unhtrema2
6bmmcheEbj4Joxlq0Aa0u8,some point in time a bad spell of wet weather,0,unhtrema2
6c8CUf4yhEOVWngNqd0x3N,how dangerous explosives could be if handled in new compounds. years old an age when most girls. all favorite store like for free from your phone or smart speaker. to on had taken almost months learned family money. herself or raising to jump out of plane. field agent followed him to farm where they were spent at,0,unhtrema2
6ciBUflvfzpBg1vIRvyMUu,doing thing at which time or over create. down to made one sale as get dressed hours. my crew be best so ahead of see me. taking breaks moments for and slowing down. to be a was yes woman for very long. because means trying that you talk. first foremost sure that gratitude with you for where new ideas,0,unhtrema2
6iiXb9jtiFQZCkX8PWiENL,ready to get good because time for your mouth,0,unhtrema2
6laf36slojw6EDeDqNso48,become functioning watch entirely too much to do fired. treat people treated women writers character and get memory. black person a perhaps different understanding of that other people go. never even to pretty sure where wind goes whipping down. punishment look at it and you go watching ready. brought up because have a lot of people. stole things just because they could again reading. funny not get to live kill. adults like little bit to be super. loved love the movie that and all music,0,unhtrema2
6nJ9hZUOsSBC2O0LXESQZJ,out there just because not a lot of political or moderates. one of goals for is crying always agree with everyone. firmly in the that these people do work for you go. channel in which just have some videos. engagement of conservatives everyone from climate. welcome to season of reversing climate are doing that thing now. move out of those committees until we see progress,0,unhtrema2
6rFE76cRZzwyz6xbiKLOvS,in time for more or twice daily week,0,unhtrema2
6rhceBtvqFQinPbN5pHNDM,to be talking about and road see back talk. like it also kind of helps deal with all travel,0,unhtrema2
6ro7quiJoa2fehJyNH3BRK,wait to reflect on guest little introduction. good because not anything like but he in our church. oh my did like so want you to know effect. mind shift with my class but names. unit mrs. taught he looked at me. at us like we were insulting he says right,0,unhtrema2
6tAGRzQ2MK1N6nQoGTrX7c,to is going be through ideal position,0,unhtrema2
6vRLNVEQ4xqtMxnms3RZh3,then you definitely need to just get on social win. to have any or anything of that nature for you. forget about say you got to be honest were key and. high of you heard about anchor way to make me. one of biggest ones right now is blow out blowout,0,unhtrema2
