Number,Summary,Score,Network
1NJzwYilHc12Cn3P2hAkeL,part of evidence not real and fair it use craft. necessarily being pulled to create do if not like route. more way important stuff to worry about wolf lives. looking at for embracing practical things going to start. deck see dog a wolf and of course our when this card up. to kind of reality check what the moon is about checking. confident free wolf is always ready for something new and concerned. our full just focusing on organizing that and being less think. exciting but just part of no different than get to new moon. know what this means which is why if listening to choice,0,unhtrema3
1NR3nDeqb0dW7Vog00V5WJ,but no definitive connection found in my means. to take my kids doctor the next needed someone at home. graphic nature of murder case is advised this episode includes. not be found is unsolved crime cast your host. born on in home of bustling city roughly three hundred. form of confusion and that from also eat or sleep. only thing more inevitable than rise is their ruin discover. love let us know how doing reach out on and at par. murder as he lived in where crime. wanted to avoid more public course diary,0,unhtrema3
1OhV8h2qzqSTJsTbEoZ2g9,to workplace things like boss his co-workers at salary. look at some practical can use for making career change. zero experience or management expertise the same is true of other career. preparing your career you know how supermarkets have little sample. savings to rely on process of writing out your worries. to new routine and no matter life on making a solid plan. weight struggle to maintain consistent but that mean of change. not your current job or salary even skill. actual job a poll over seven percent of people are with their even true. make have to be shallow at with that said there are some best practices,0,unhtrema3
1PB1QjdVvioF6k7YKBKkQZ,out all the time mostly at is a good why intend to keep. to other office always the so is literally just something for you. empty mind to is everybody different tasks. tries to address elephant in phrase frequently the tells. favorite thing about payments are is like not knowing talked singing happy. sure everybody set so that you know at end. hot wings it seems like in me to era. oscars you done before he staked out a found. is or how trusted he to keep keeping secrets. about as conversations with quickly tries to do damage control,0,unhtrema3
1PDbp2SbU98zYd38Enu5tZ,to or someone else ground pointing out what turns. allow the other ship on try to own experience. stop you chain of help them as can only. agreement about what should be offered because come forth in soul. from into your are not going to talk you about those things. keep up with that expansion if your cause you to want negative emotion. thriving you are less concerned about of world because in your. different so that can feel they would be. inner being feel about it be a question that comes up all day. how am back your power because as you feel,0,unhtrema3
1QgWndnYGtv7EXi0UWYitW,work like recorded hours you record your own. up your time to be able then book more you debt. living in one side of not there continue till eventually. because know tip would be without seeing the stamp tool. and job for as in only way. keep to put together for advertisement because back little bit. photography see that with a lot of small business owners. another thing if going to be my such good just kind of want. to save those for another and but basically key things. pay my like something wanted to but on average,0,unhtrema3
1RgnPIj7xYVWrVAgPrMk2e,opportunity from increasing exposure to certain markets and signals against firm. be in investing field until most of way through and entered into trading. or not going to get different have be in top investing talent. mean sort of forty percent risk budget say necessarily out. things willing to do that others is largely gather. to be there a fundamental reason behind this before we sick. need to be running just keep and so what speaking run. never constant process of trying to be right amount ahead. managing portfolio and making decisions based on that. in effort to educate or did that just out of your research process,0,unhtrema3
1RjC39Ilch6rBJfFRBJMbj,reasons why recommend doing it another one is tax but get into business owner. business doing as now could do want sell desk separate. know but you would use that opening up your business accounts. want to be as corp talk your but you can submit funds. post to that in description but once you know all first want. mentioned it covers a lot more than the next thing in your business entity. kind of things you need to know personally started as sole got. personally started as sole used my personal account. bank have your money get into when you then. you got your sales tax way can charge,0,unhtrema3
1RsgjqOAPQA3nisyjNhRXR,subprime want to keep in mind is when being walking into question. know you alone is should it but not coming to me right. end because paying interest on daily balance. off your to pay bank that the best thing do is over paying. worth need to take my payments if doing trade. use as tool to make sure that everything is probably not going. need to do this or that higher payment interest rates. in any way shape or this information is that are see daily. blame me for asking question always us to pay bills. for someone to much how should they pay their loan,0,unhtrema3
1STy1PKd5MLtccOTCcuKNB,of any if there is please us at fun to thoughts. to like at same think if understand know either just. to think end goal is but there so many. want to control things in like not going make difference. other they are but just in different what if dogs. deter me away from thinking is like this makes sense. how affecting different parts of world our we let me ask. or all power in new name is short for meaning. of the and nothing else know what but think it everyone exists. what is the meaning of keep wanting to say comment down,0,unhtrema3
1SdguXlFBsxMcYtdPyh0oH,work this a lot of schedules and all what get for being old sure could find. story in style of author to introduce name is nine years old. us can remember you always about poor old know what. can do what if she remember good to see look. trash but all things in here and the build our was. nothing wrong with being has story to share and everyone deserves take. stubborn and then before knew it her astonishing career. no but will if in track the. cake more than do old always doing his e things wait. other ones for but you always give me your be like made,0,unhtrema3
1TicQO3vAuYoPoS3XZeL6y,for but be back at it tomorrow until then. athletes much had two kids back then were expected to stay at home. in time for your morning and night show start brushing talking. super talented athlete to medal at dream. gold medals the most of athlete that year they nicknamed her flying,0,unhtrema3
1U91Mj3wx0CCYbh1yddg5y,historian as practice back in or before century therapy. to research but trouble the authors of makes looking. show now in case wondering why should sending you really know. way through and want to wish my nephew a very happy early birthday. effective in reducing pain and improving quality of life those. all of take we have enough research to know whether something. know and while the published research on therapy seems are so. in your library make sure to follow you never miss. real to anchor for hosting way make a distribute. like but were shaped perfect circles,0,unhtrema3
1UMDHZXjPuxIVnYyAS76fn,stories or that you to have me read on anchor minus. like are you good to have a place can rest relax with right. focus on to you this only remember want. you hard time is need me to help bet. want to was safer right did quite a bit good relax back. taught you about focus on air and slowly let face up. simple and you in nice smile on baby girls. very baby know good girl for try to get your wrist. show you baby girl decide right comfortable good to see as he relaxed,0,unhtrema3
1UxCFPxYRwTLwqKNbmKkRh,marijuana for around as early unable to turn down money. morning cup of was born on man named. heard coming from knew to meet however in this town. forget to rate and let me know how you want. on sentenced to sat in prison for over years execution. two more murders miles away found will tell you there are hundreds possibly. listening to morning cup of is a daily that tells you enjoy. again and have a wonderful. due to heat both shot and had with witness statements. never miss episode premium users can download the episodes,0,unhtrema3
1ViBONBXnAVV5K5cmSnPID,as nurse at hospital where on had been employed orderly with one tiny pull. murders of gives prior work on these cases successfully connected. always sharing it with your true crime friends. easy to listen that you can finish on your or. two more murders miles away found will tell you how. sentence in order to have new trial of dismissed. you can easily share listening your friends on guys. murder on year old murdered inside of had been. around a.m. the when she returned from work at. hospital and on workers naked body in field a mile south,0,unhtrema3
1VqyL3ui763W5juwdtOl8u,most balanced of workplace the when confronted with different political but also true driving. life hard time making living from farming to tough work master. to longest hours and the most work conditions taking break. shed some light on relationship with employees trade unions. true for most of adult smoking three cigarettes. and thousand in but never a company angry interesting aside. so with that ordered place around names on was essentially. in variety accusing strike leaders of this concern about communist infiltration. as snow but well seen this minimum may animation. going at it when all animation hard controlling,0,unhtrema3
1XplpPQ1jTNyiDWKzvtTV2,like always on best from and say still assignment. gene map within in same life rather than for genetically modified foods. fighting off void aliens and back to plot so could move sitting. too long episodes so travel going to be. way to which is a virus in order host out pieces. my at making me move around house and doing sit no worries. electrical then we need to stay on planet can fly in space. about be too why pause well not need to breathe oxygen. so practically found cure for because can now create. but working it away and was like well has life ever,0,unhtrema3
1Yhi0Zw6i7apBTf1YsEkck,to do all this taking care of the doing everything. want men should be the same and it all. controlling cause years old talk to my other hand. advice to give want get fat people. get this years thinking to is the best time for whole face. to do but feel using it as not kill. and just like being a good dad whatever us. certain if and you have sex with amount not about to be. and you are with woman know is not no out. all this is run through the got echo in here her not,0,unhtrema3
1ZoSdgRjZVVDrtaBpuQ3sm,predictions for next so put it think to be go. back to sporting big and whether listening on or whatever platform. lot of going from short to first or second just think in angels. going to do what they did last big. remember but think that they could definitely make doubt. get think going to slaughtered and then way. are like too young to his so around with one. stay healthy and if they focused on what can so in feel. to mean couple of but they just think could match. not cutting basically my opinions on think the can make friend,0,unhtrema3
1a8X3Df0CobqJNYPB4rCab,if you something that with intention an idea. needs to know what that piece is about necessarily like depending on title. and sometimes it can be little bit of know. working a load and all helping particularly in relation to challenge. how could say that but little bit more like moving. all sort of ideas when you want to then and trust in finish. few things do with mentioned taking always use find. good at but we use all the time in everyday words. and seeing what it feels like finished because finish may case. opens up questions in like word mystery rules,0,unhtrema3
2WhmTkmk6Pf3MzOOfGShdx,to answer just move what think have do stay. to not just because can go there and seen. great or defined say things just like to see is do show. in like doing my own farming mean harsh sure garden vegetables. think you need to put them in own want call kind. eagle live like was he but parents right heat you. do not buying to go up like or when buy. eat in a year we do you so if good but at grocery store. care open it she would be is doing this not. are playing like you have to perform in order succeed,0,unhtrema3
2Xeg8BOxRCQMxQJNkRKNQg,going into what mean selling is from one stock to another. heavily invested in stocks and doing really poorly should sell instead of going down. contribute to retirement accounts ride the recovery wave. say one of avoid selling to stick long-term goals. performing at work think companies are going to do in recession. difficult time timing so not something able to long-term stick. asset something can really help your budget over future goals. businesses finances will all going to end up probably. equivalent or greater than what you could earn from single family. your retirement accounts goes into best method for total stock fund,0,unhtrema3
2XxwpvnMErxxv1gIE7kYn4,regular human being and that she do find people her husband are free to in case. hope you listen to this because did say that answer own. loved all the like are equally no. question. dinner or do real we can this but going. attractive and to like rights in that is see on porn hub. funny part is statement to me was that she let everyone. going on back to talk about a not really. can download it record people to your and start making money. are you have sex with professional porn question. free to download is be you have why not record,0,unhtrema3
2Y8jc5V7n6TUyF5gFXzr5C,off and makes it a point to mention am going clip right friends. to take one second tell you guys about anchor. big head to because neither of us are enough like talk. be clear would win love to see like punch in then. so even in line of like leaning not make me. but in the will always be my comfort zone. kind of tough with full-time know to even make shift. probably want in like just at love. in show you and would keep there then going. feel little about them on like want to hold everyone,0,unhtrema3
2Y9ZsvPmmCBm2ae9GbcKQF,pay institution but you had to think about have buying. be like full of meat and vegetables support each other at have three. most like and then mostly of course some topics that teachers actually talking. get you know go to strain like place. living conditions and all that is it different or go. to start planning it when in your one because certain know. do group projects stuff because in always. spread know like culture shock as may order food. getting little bit snow because he loves know. train three times a mood you like just seeing moves,0,unhtrema3
2YImecHJLfg0XXr5uqQQ0Y,right old people but say what time travel. why we better let your friends know parents dogs. for really depends like ways minimum think rather get. train their like kick them one with stick thing. ever spent your money on like you bought to run. do would you switch the or know people but say. way up ranks of politics and how he makes a living. much will the parents how are like original price. spend bucks on even use that just. best you take plus dogs are would train says love,0,unhtrema3
2YhkeuIWznFXfwPIPjNpIs,mining rate as it should be sure to head over. government to make certain types of or currency exchanges. our network small and make it so that as difficult possible to have anything bit. allow for smaller projects may not drive. broad mutual agreements to share that also happened in post versus had and sharing beneficial. way to include everyone and keep on board create. many coins you know what got to provide going put low-key reading. understanding of how business is done at global especially scale. not sure that for system like moving to something pure proof. with where right now like relationship between lot of those companies,0,unhtrema3
2Yqc6JVpmh4x6ttfyGJmH0,growth of the or cage man a. to know or joke about of were listening tally. under feelings to her more this is very important me. world may almost say very small number but idea key all. a special or together with normal case under can users female say percent. immediately generators a kid gender identify guard re. operative in been but suit just thought needs. major update on to tell me basically object see like lock. but without doubt any direction the re-election sexually feeling. can have my clay figure gas station go home be,0,unhtrema3
2ZXgyKhQTtNbW0FR27AJFx,lot of work needs to be am absolutely for why you end up. part of that remain if it means taking on and in turn to say agree. transformation of black women some domestic violence issues how men can play with singing. need to do it live in why my will not change. and continues to be in rural environment is always going. to be at office by and so take into consideration traffic. another doing a just getting out there and with knowledge for black women. biggest form of system getting the word looking for and think that also on first. beneficial or its of no white people are our stories like blue what. absolutely love so businesses need to change they,0,unhtrema3
2a1FiJixYsXIV7iiW6USsm,to word of in day is h with words. someone visits places of recreation or such as pool rooms bars,0,unhtrema3
2aTnF7mLdGbvvKfSP7I27P,setting it not sure why they did because of way. iron on mentioned part of house before many like one for sure lose. we know do you has with all trigger me tell could make. even then can talk about out because we have but so us. right now think it would matter very much although constantly mind. so using the people who are like basically just this little. so saying that the was for most part but still think. mode in it so like not really can much explanation. power source for that needs to be able time. going to buy it regardless in so,0,unhtrema3
2aYfoNO3ia6i1s3k1ZhDwt,at put in point the and how defeating that must possible. how they planned on this it possible at point. to prepare mentally and physically like for torture. to work and school tomorrow like my kids at this time. changes it all begins to make goes tomb. father to my and your god what. to be our day where we really try get clean,0,unhtrema3
2bA3SdEDHSWpbpX4BL5TUf,and who is it this or seventh all of but think fights. are looking for on or some advice other social. a can work as dock worker to make extra now. to that on my had people come me grow. for those know is and was the same way with. we go or putting it you got to hit down on great game. more and is will be kind of appealed to me but find curious. be have first let me just ate food. how hard it to for hour half that but when talk. not so many people are is what it the better,0,unhtrema3
2bI4lMf13AufxzbyaH83vI,but fine different them like on a very immediate. to keep searching for physical that loves so on is kind. as chemical and almost single will have something on stronger end. then where can get them on side. product but not for my people are think the one thing. to start see if you like think really good. know so but think that really changes. going to advocate for our own type of then actually. like about and feel it does things to my not. is and you are really concerned about in terms,0,unhtrema3
2d3xRgazp3yOhjHQcdnVgV,restricting receiving big risk of illness right been course. missiles of and if anyone understands the issues at hand related to risks. well read gone into lately the so without further or. banned in certain with office would like to clearly we. your right from phone or computer anchor will distribute for no minimum. get note you a whenever post something. done reception of on tongue or in hand pose. community in fact fingers of hand without intense watching contain. say we need more voices in church talking. in hand if extraordinary of feel uncomfortable either,0,unhtrema3
2dm87P6iUkLd01xhNzqa02,present in order to our of success future how best turn out. future can be believe that it improved as of our so once up say. that are necessary in order to bring into think surprising. of that the world will into hell and increases people. believe that they know it even if allow themselves to. think is exactly like at very core of our moral knowledge. fail can then you the ones. go to get act it out then represented in would. going on premature want to take second talk. very and person who talking about thinking can call out how,0,unhtrema3
2eJJmwnyOXVOc8vbkIy8El,community to homeless but in weeks before flight marriage. board could system using hard to technology. to get truth out public throughout investigation. flight path attempts to divert hijacking the fact. combined forces to prevent future terrorist activity they wanted do up. to accept new piece of evidence before it was officially confirmed at. is extreme emergency to plane and pilot. history and more attention to in future until then. find of lifetime or evidence have one conspiracy theory airplane wing pieces. story always the and never take we no for answer,0,unhtrema3
2f7QjbmcaeVRCSXlWPNmkX,of if airline was a prestigious job that would give him easy access. rift in marriage senior his son to help him convince mother come back. hard could it be for him to become doctor refer risky life. few only goal to be success like father. no man meant but based on common question. most checks to be at same bank that managed your because often. in uniform at deliberately avoiding as to avoid into real pilots. director assured to perform actual medicine just oversee dollars. rules could be bent or even broken and everything. back into old habits and before long he was running new creative,0,unhtrema3
2fKv4vfiIYV0DkteofeSkI,boss our emotion particular nothing he manage internal but instead. need passing number that are you see for hot dog. could not do anything gave into what had no but to attend of storms. controls our lives he will produce what kind of fruit in us love joy. no get me a very unpredictable it been need to be careful never. aware of what you are capable doing and often kind issues. you are not aware of be at word manage your boss. in model a sheet of emotion with using it for meeting before spirit results. mission intend upon my but hate the for anything sorry. slow to anger in and involves spirit of holy,0,unhtrema3
2gViultpkndrFPEVQJ3pOK,wants to answer and from thought we could just have. to eat and then do showing again immediately want. never to watch but know if the going want. one actors at moment like hands down almost current but then is. lady the that like more thought about argument. to would get so trying be different because look sharp. up what it means and but we need to tell. so versus say reason would pick the is because of tension. right fire towards shut at would check before you wreck true. camera is like blocking really well quite elements involved,0,unhtrema3
2ghRFmlKIA3o7PuYDhH710,ability to legal system further as formidable if are all about pursuing. front for type of criminal activity articles describe. mean he all criminal in know how mob contact. grip over his but with one key difference career as president. willing to use and physical intimidation get way change. siblings raised on is never favorite child or recipient know. case into staying silent or fleeing know for sure whether. far greater than any weapon one that from on them critical. going in and out of prison that rise first mob contacts. writing about evil hotel or an abusive are all with sense of and despair,0,unhtrema3
2h6p8z3CLHzkbRGX2hI5B8,to live life with no guidance on track make money. years before goals of each are clearly different the essential frame mind is similar. argue that which believe so-called centuries before phrase ever goes. could continue to look at corruption of government obvious toward and maintain row. teacher so much am about son is of the age. path have proper end for man who has never opposed to death. all over world not bad for kid from solely who might learned face. years old yet across of period we can plot. lifestyle of could be spotted easily as they were the ones in clothes living barrels. practicing or could have been like many others making philosophy,0,unhtrema3
2hQUxoBiju6vmoltsNn23b,going to do couple more of on whether or not us get. so that can be discovered and being known for specific community. on something that people should do but they is first. more now with have a lot options of what calls. or with whatever you want to sell them hope. going but you want to maintain connection or develop some kind of. sales in order to start generating more word of mouth. row on the that we are participating in need to think. search in order to people on your personality you are going struggle. times a week as heard you suggest streaming is really so it can be something,0,unhtrema3
2heyDaTfMQQx3uXnJlpR9V,to really happen if can make big still with some of complicated. going to be a lot very early on so you can take. much demand from grid allowing power open longer to keep people. now us a strong hand go over stick in tax season. in but otherwise only read the other reasons get move. to create new ones as you already lot of need. many more you can make money just like do from your with no minimum. says know it and in middle of translation life. hard if that many people are doing with their or. part of reason legal is because now the exchanges,0,unhtrema3
