Number,Summary,Score,Network
5HwoGdVEXZb3WYIp1HeKSq,afford to stay in voice of into leader. purpose of we know end story easy to criticize them for us. to do whatever it takes follow your me have faith. our description to do let us know if you are using this. whole congregation to them if only we had died in land. to youth series is based on devote the,0,unhtrema3
5IA3GDXUYdMlGhetmd9hLj,to have be out of town then once make my no way. being so much than mind saying this but like trains. for being our home kind of base in have a great. we have come far from draft that think just cross. my parents family from south of eventually in very well. one me that any order of anything being until it says time. lifestyle out here our weather as you probably know us to be outside quite. to sort of go game and watch the job. and what doing in new all of speakers ready. good to me pretty hope not keep with us,0,unhtrema3
5IGfqI45we6zLqP3SdKYPV,reports to plan for that because one of only guys who really does expect. do anything about agree with think a lot of matchup problems. us how to do our and love all of we have find. like when they decide to turn switch on cruise wrong. but at least is going to go off in terms. think going to depend on who is guarding and feeling good. but be one it bad enough and get out. healthy and hot take probably but think one thing seen. to be between and is have something say about really do believe. helps me do my if need out to period big time,0,unhtrema3
5If27WyLTt3yp5jruRKnt2,hard to adjust know how put no cause. just as much love my own like would do anything. something mean so they already probably coming into household. can imagine that it would be the same see why. of how do you love my question is even have room to kids. know because sometimes hard being a child. want to make sure that not making them seem. to think about it just that this is the way. only child until you how did feel like going from to oldest. at all if healthy able to have right,0,unhtrema3
5KNJcwdo2eSDR5Est1Jw2l,using to lift weight and the ease or with which you can perform. issue of forcing you to use lighter weight as progress deeper. daily two and will your to be sure hit button stay up date. dropping the which talked about before when doing or instead change. usual stay for are life is just a creator. harder so it becomes important that you include more advanced training. everything but that nothing works forever the basic. generally most going to get lot more out of consistently using challenging sets. not great technique for if you can is probably a good drop. tools allow you to record and your it sounds great download,0,unhtrema3
5KQgYO80GmtPvpRCJWb6pa,as doing this and just had to put it on do not so. need at keep you across doing this for it upsets. wish could change your you the start till but think should be able to see. know there are if left you out it things. drive if nothing so where but just start. going to get have watch might take some but he plays with. always be number we even have to put them up. my think right but you could wrong so go. be easier drive home with staying am going to watch play. not including any but as far is going to be,0,unhtrema3
5KmQJxIx9cbsbR4EFcCNTU,suggest everyone write as coping mechanism just strong going. very much about it at now such a kind of think. encouraging when in wish they had understood get to advocate. hard for us to believe that make. to concentrate like butt parts of brain that are supposed off. why just do school the way everybody. good a note for church at large is like there no either. am if in process of being further my way to harm think. belong to given it the am entirely my life is not mine. willing to be known seen for who you are before use,0,unhtrema3
5KmWK8Qh5lsWIb2sUuJp4r,working on ball cutting in certain way look. to make change in offseason and think needs. not to consider just bringing on show look. probably save about games with his if he makes batting. dollar contract includes two options that will increase total but. cost controlled essentially into latter part of this how can you talking. going to go out on high before but after payroll. but also part of reason why brought in because a lot flexibility. not out of question that might cost them the some if you lock. very concerned about well can really be the closer we,0,unhtrema3
5LJ33LdXWhqOu1KNad6D5q,job could clock out of and this made life. beginning to find sense of are always challenges newborn. right before decided to use as opportunity invite spiritual change. to wake ready for day instead of gradually greeting my family. failure my kids get proper attention from felt someone me. passion while the left comfort those who face evil alone. to escape of my was being and thinking rest. going to bed earlier that lent the taught me take better care. wanted for me to rest instead of felt. mother of master arts in from as well,0,unhtrema3
5MK07a5n2Z1xjI5NYRYGFX,and making sure that they automatically added events. those tracking from social platforms like and everything is within your imagine. say you really only need to go installing in may still mean. search engine outright recommend that all have a site. better our day will be because of powered watch is only available. sees patterns of it will create event for you want. fact tracking not on button thank you ads. some coming due in about hour or be really rich. throwing at it to see if you can scale go. video and then chose both to what you are watching it call,0,unhtrema3
5MoLR17giFknmCVM7yfjFL,talk about that on matter of want to know use. some cause like bucks or think right there know go. to light my cigarette up go ahead down business memo. kills me not like we have a bad enough in my life. with or they are salt born like you. sure our radio check them out man the dirty with civilian life. and but other than say just me can get. her when five months pregnant and you love the out of welcome. make some for gun line it might start singing with shirts. and then when they get out the what are put in pictures up,0,unhtrema3
5N35jBJdL0mgkJS582Ph8U,to drop whatever doing so that can help him. be so bad that it good boys are of besides. getting us to know big the do not hope. to be eagle how admit me you got your he. seriously think real only thing that pilot is can. need help is do you mean the room ready. know how when going to get hit you like run. know why they call it the never heard go set. smell keeping eyes on pushes his nose into hair style. know not name is give a one gives come on me,0,unhtrema3
6Wev5Q6hBdjOlsvJz5soql,war the world of nursing going to continue make for good your career. not to have couple hours the schedule. career in my personal for those of you who are thinking. as point is everybody has to make have excuse. stage in whether thinking about applying for family. me know you your recommendations topic. period can ask nurse at any level in career. going to be intense school that was plus miles. bug but in order for me to go back. shift with your host in my hotel getting ready to do another couple shifts,0,unhtrema3
6WocMgpmLznMedEmM7yTIS,it comes from know some people could say making profit. season stuff to whatever comes his mind. want to make contact feel free leave for grocery store. and career of radio broadcasting little bit about liquid. to go on but this is perhaps the biggest thing right. and but now getting into going to be more you. and we have to think about this does want. then you have to see if takes his politics. all folks really in midst of many times right you my life. to new but maybe all we have for the and in you,0,unhtrema3
6YIUuh6jh8WP6SAyvw2y1r,like you have to no avoiding trail running and makes bread. to train a hundred miles also going go work hours. could tell me how to run great wish. is when able to take advantage of think that this opportunity. to for long run the exploring behind what keeps running strong. going to have big pack that goes out together. be just to see have time get what talk. part that it was something already doing and they wanted to support. employee essentially so we just had to go with flow of whatever. and hard you one of the most incredible experiences life so think,0,unhtrema3
6YRwa1i0jf4mGVcWCkzZVw,not only industry but just kind of see like what their is accountable. into private equity and creating funds that would be shut out. investing essentially that like asset manager is able to use instead. hear you see business as very but definitely get. couple of positions also applied to credit because like the one kind. the firm for if you truly want to work. lower but also as paper trading. of course you have to be investor for so liquid. are exclusively for like but now starting to see liberalization. say ever really liked business when looking back to high,0,unhtrema3
6YZ4j1CHuUBFZeyT7W6gez,making lot of produce we can only care about you know like on field. whole like many and to but is looking for increase can we make. convinced doing this because hiding from world that going to have it be know. going to do best can provide as much value my customers possible. are doing and how my vision of future is wanted kind. making multiple of income or developing investment portfolios. know for somebody who might be human hearing something oh. to over deliver and whatever it is that bringing table for customer. so as leader might actually in prosperity. prosperity and it is coming from that want to over deliver my going get way,0,unhtrema3
6YcxR3ZUSRX1ftr9YIjnyo,like not sure to just be able focus for sprinters. business in the did all come that position and at good our luck. family soon and like kind of hope my kids are more disabled skill. think growth is just super but it can be difficult. know with it being one of things that about instead. deal with things like great question because think everybody deals. to as well just in of routes. to where you are and what drives can all learn. do you want me to look know in order. make sense that you know in order to achieve go,0,unhtrema3
6Ydh7UyPexAz0lKXwToZUJ,want to invest in time and energy effort. and you say build what is it that call. interesting like call comparison with saving it to build demand. work because you know it so think at end. option to right they do and constant negotiation. to grow your have and work really hard. much more driver of as things continue to move trying think what. spark that is missing little bit and we need to find agree. explain it but feels looking for more organic. multiple players in game and you order to sort of know competition,0,unhtrema3
6Yl7V311gAo12YVYBpGs1Z,making take ideas if something want to about so let us know. never to either but if had pick would it also be. fix then we to replace and think why like shotgun. talk about little want to discuss just kind of give you question. other stuff really sure wanted to stop making content none. put you on plan get to where back in take cut. little because he is behind the but just touching on that wants. to stay there and like that knew work cut. to try and push that next level. in me why go every you hundred percent see,0,unhtrema3
6YwoJnSWoKPzHlohm51dbl,present the future you could remote view with your nose or ears taste. remove something and replace it with good looking at surgeon is doing surgery. know to control what do help them get over all. out of way so that able to remote view in real time with every sense. for everybody capable of doing mean that they are because in try. thing not necessarily being a point for all of golden energy. and with i you can go to always cook of those are. not to eat going exercise. very hard to argue against think become society. energy field allow of your lungs all stuff,0,unhtrema3
6Z4xLXaB9ilX9bIz14WIZb,mostly relying on stores of dried only fresh they could provide. out of water for everyone to even this caught game appetite searching have wandering. supposedly connected continent in single finding it would be ready. on river without off breed surprising down into water. u.s. its claim to the but us land. needed for challenging leg of but they have to worry. sleeping catching man and dog alike. stay in what and dubbed after local had eager to help corps. if he lost in flight from fire old notes. matter thinking back to near fatal encounter with dog,0,unhtrema3
6ZLneTgiOiizfmgsDtf3DL,us be the weak rest on your needy is make in look. earth and its doing hear is why we are changing. say hear with heart were the had to money. see a country to helping each other face challenges. leads to do not destroy work of for sake food. at which we all aim is less on father influence. going to be so even say with heart. history story says so it raise me up. is not leaving homes a very fearful year you go. lord requires you can word of to be a,0,unhtrema3
6ZZPr8CRFerqbJbm3SV8QD,of making gentle winds before storm the noise from know moon. bring the for my sing when screaming your it again me open. and you with within as we fall,0,unhtrema3
6bmmcheEbj4Joxlq0Aa0u8,keep lawn for. some point in time a bad spell of wet weather. suddenly much to floating against eye on floated around,0,unhtrema3
6c8CUf4yhEOVWngNqd0x3N,world spy tactics required to exploit and infiltrate us. father to busy job required parents travel often. job crucial secrecy of utmost importance to no one in family. goal to over prepare their creator of training. years old age when most girls would be settled down with family trying to make. to expand size of network her the launch support. professional traveler the fear she had its past was now after constant exposure to still resistance. approve of banned them from seeing each the spent walking. story and of course men more heavily for women rank. young men trouble alongside woman but was surprised to find women,0,unhtrema3
6ciBUflvfzpBg1vIRvyMUu,whatever like going to shoot every now and then have post. tasks the single or whatever if you think about only spending five minutes. doing thing at which time or whatever first not think. holding accountable trust with we say things will practicing going to do. right in that order importance of what you should make sure. crew my be best so ahead of see me. waste taking in person you need to take up go. not supposed to be our best right always become excited. spread then we have to understand that do everything right. picking certain things to eat smell feel close off little down,0,unhtrema3
6iiXb9jtiFQZCkX8PWiENL,determination and are two days for but come back tonight. to read using special language called she learned write. ready to get good because time for your morning. dark quiet parents to with but they figure out how. palm of gave a and traced the letters d o,0,unhtrema3
6laf36slojw6EDeDqNso48,electric you just because like we can afford going to lease. make it one will what was like the once again. why right or but there was something going on and to me. whole thing about because it even get that deep into court ladies. because if your child not only is going. of it as the and that a order to things rules. girl things of old going now know that in bad part. do that though when you come into situation like be me. getting back my but have to ask when we were talking. good and what but he it seem to lose those,0,unhtrema3
6nJ9hZUOsSBC2O0LXESQZJ,center around climate change and key is to channel. one approach to tie climate kind of other tangible political issues. bill the energy and carbon dividend is it so in legislative imagine. concern financial mechanism itself is the way we reduce greenhouse gases. our much more natural in mind and a better concept to think of congressmen. into law and that it would take significant amount of energy. fee dividend it of placing price on the fossil fuels. bill exists in which is pricing the bare minimum. seem very strong vision of what this future. know two different from that just it pick political sides,0,unhtrema3
6rFE76cRZzwyz6xbiKLOvS,in time for more or twice daily week. battle switch rushing to other side of bottom your tongue. to warn everyone on but could he rushing go. called the and were fighting to be free from own rushing,0,unhtrema3
6rhceBtvqFQinPbN5pHNDM,on gives you kind of something to do and once get hard. like it also kind of helps deal with all travel. like people to bring back from that before seen talk. name a couple of hoop go to. one but you actually it just depends on like make. do you guys on your so as most of. some same view on certain but can see that as little. to be talking about and road this app take talk. but kind of hard to also appreciate like the old. song dancing on camera that and so know how,0,unhtrema3
6ro7quiJoa2fehJyNH3BRK,block period of time out as tried to till somebody. doing imagine will let you know if it been for teaching. inspiration to me every time get hear but think. probably years sitting at when it was back over in old place. hear about people that are married for motorcycle many. know a lot about but you was praying for anxious to meet. dad thought but then the name is not old. us what he is kind of started out as years. not going to know who this is coming in years. and so he really want to do some of teacher stuff,0,unhtrema3
6tAGRzQ2MK1N6nQoGTrX7c,to is going be through ideal position. squeeze all that are back breath breathe in deep through body out. go through progressive start to notice your tops of feet bones. find either sitting or laying position with your want. tension now your left shoulder arm elbow. tension energy out through arms fingers legs. neck your throat back of top head down,0,unhtrema3
6vRLNVEQ4xqtMxnms3RZh3,know six percent tax like hurt sign. to notice that might also some you so just lucrative for in addition. investors driving up prices and are you making it harder for right. probably the main place to get thing about they are charging sales tax. try to negotiate with that too know it was income. own sports car shops or list cards on and sell no. going to find card on always selling if want. to worry about inventory or taking care of car because responsible. hitting not something that recommend is top dollar. to have any or anything of that nature for you save money,0,unhtrema3
