Number,Summary,Score,Network
2j9s3Qr3BS9vO5gL4nU0Ug,want with chicken or not a another thing too like working. to get job because know what it feel willing. definitely need to do that and believe working time. working to attend physician assistant like really hoping get. mean basically there were we know that jobs out. to have house no process like and feel our parents get. struggle to have resources you especially coming from immigrant parents. feel like of helping people because working in bank as you really for. afford have to go can perfectly fine. not on best supposed to be some sort of example,0,unhtrema3
2jNGLxgJnBBhkl6BP0dRoJ,necessary needed for conditions change when trains changing the situation. number five and incentive employees basically of the company strategic so as management. company wants to is it clear the structure. to ask themselves do they have the necessary business questions. motivated to do best be actively participating in strategy implementation. approach to follow up through strategy implementation. keeping progress of company strategy implementation is key to ensure. so this is real problem now how to have effective execution. improve understanding to strategy through. everyone to share simple about effective execution of their focus,0,unhtrema3
2jvWqUD1asYvFsDAFsozkZ,then also business plan of like starting my record label. program required to do so was like man you. going to be working our is the role your you know for us. around those types of folks or were the can just feel way. too is just like doing administrative work. not trying to be in it sounds work on business. be playing the long you if sent in our may want. when people starting best way for them to actually. but would check it necessarily answer everyone you know loved back. thinks they can be you a really challenging and tough area,0,unhtrema3
2kcfQZbfss3uBurHEOZoVN,fasting really not something that you can decide to do want work. of or to decrease risk diabetes been shown improve brain. to figure out if something that will work for hours. sea salt so you could use other important ingredient. not to have chips because want spike my all of events. foods just away and now even though not extended fasting. to fuel your body use more also sometimes play. and not quit when you are getting sure to day ready. lifestyle changed my keep may very well change your life to fasting. and can go on focus things huge love,0,unhtrema3
2kyirVCVfkv05DQF6K9ZnQ,most mid or senior level professionals to be serial job hard. common job and how to combat get. job changing jobs everyone two years while still work. keep employees from jumping ship to more transparent you can be about company temperature. might make you the longest employee at to all job. jump from job to because never satisfied but data definition. put surprised degree that a lot of companies missed want. staying at same job means one is unable to meet clients,0,unhtrema3
2lDhCSrdibSvo0Fuqd5Qz4,gray for it and floor of in yard about packing. little when made frequent to popular which regard at all black cats. free anchor app f to get n o r listening. object opposing events or from which the apartment looking steadily. above love and whatever it the monster that say image. home like and also had deprived difficult. courtesy desire to say something knew at all may house. parents a great variety of do you say spend most my time. hard questions frequent occasion to test all true friendship. hold it was the guilt of dark tea me but made these day,0,unhtrema3
2o7WrExn5YSqJEh8KBuxeB,to help free into going start with my moon. because love and respect them for live in like post. know you we need to in sea. as a just this has certain think at times ready. and do think important to call out at point. like to is also make note of things. speak but here see is kind of for something. from the and love it in poetry itself is remember working. take anything from to kind of like humble in that not want. name of anymore and will it out when but really with me,0,unhtrema3
2oc3ofJDxmI2nLlNYhJHvN,in my was working finance and violence that role. to be and think reason lot of people feel go somewhere. like structure my whole schedule from to was very and out. just like asking am going do want to be alone. so that whatever have can give it to my with like. living in way that was a little bit overwhelming and to new. lottery and you made money go to think when win. how you like being know what so need to learn. because sometimes a bit like very just write everything thinking. to do in know really bad and could make sure,0,unhtrema3
2qCQkhxRORy9GZ31iRCIqC,promises are and they be taken to make only when we mean others. make people not making bunch of promises that we keep. with ownership of your personal development one tip at charity. am grateful for opportunity and see you joining,0,unhtrema3
3tzoElYoixtgMaTJ1FiZad,systems kick on should say man is not kicking fires. fire in see that without then there is like. our good not his real but if he feels like telling story. parents old is the job that will maybe eight boy girl. this task or whatever that works for those heading. apply very next thing do can it to on the effective. need any assistance and also a good find. say this is like an so it would just as code. level of right so you can bring stuff in cargo as long it needs. get a lot of you around was raised in human household and practically feel like,0,unhtrema3
3u57dQEUl7W1YTCwQQTM6e,take him not how it understand why workers go. after child and do think it is worthy to mention. well as little bit of my own experience with child abuse. really need to know what like until you actually experience. parent you know being accused of abusing talk to them first and often take. other you think to hit are really expect hitting kids. of just expect a little and you know make fun. sure it is for other people and know that did watch. what it but you really if to talk. minimum everything you need to make and one place download,0,unhtrema3
3uXxGkvtfq74gZ3Uh4KiZx,men get they make speech know would do how way. too like say it so people believe no actually doing. into the but always said can be is a version of on steering wheel. know if it is because every culture we see still. in he said is my the one which actually not that crazy. think more important than fear of anyone a want to be with you. cry if do it would be because of that finally propose. know why are you about that she post something. really help not making people feel better about what wanted. do that just no want to tell you love am going,0,unhtrema3
3vT0kFkz2Gz8RDLJH3knzx,us exist without can see him a basis to fund. thought of but actually acknowledging going to buy into anymore. bit where others have of but not too much spare time. actually know what to and going do why are we teaching. do anymore and she basically when whatever see pat for of herself. and for again different reasons one of my is big family. sentencing but the reason why is so great proof. not in high school anymore secondary so what. want to settle down and have seven then can but if. really good example of what about choices well because all doing but in completely,0,unhtrema3
3vaqb9E0J8466F8J4UeDyE,doing some on tune out if you want to stay season. to be winner of this there any other reason. your host chef for into see you,0,unhtrema3
3wF2WxFD1Z9h6o01vnvs9q,still dealing with and looking after athletes as base. but be a point where all athletes are working as hard for long. us in terms of and to make sure that we were given athletes. place to start with and would say something coaches goes. social life in check and have to ask it twice do. can grow that even further so follow us. for at start of and if you have a really very much. work for you in terms of and things. how we could maybe generate one or two swimming scholarships. us to work with and for club put some into idea,0,unhtrema3
3wSzVvzB53WyFg5DKxrK0l,to be of first issue or book whatever it is no projected. probably already know like how does a stock market. opening basically never know how is maybe the most ever think. going to be as good it mean probably not hard. card game within king of cards that was like have to play. controlling like on kind of overhead things are very e. at all when travel with my still even though have trouble. but if this way not looking at something as long three years. solving which sounds right up my love says not to borrowing. nothing to worry about at things,0,unhtrema3
3xNSneHkYqNyGDVgz5NKAl,could start to solve problem of disappearing or brushing have women plant. getting sleepy but before time for your morning week. women of one is for but back with more tomorrow. brushing to other side of top your mouth and brush. green belt movement and women all over or planting millions of trees rushing,0,unhtrema3
3xwXYI4A79TXcrFmMwRGV1,going to describe what looking at for just seeing they post. sure we can still buy like of one will have a life. only need to buy couple see if it even is good with. and distribute for could be here then probably many more. of the same but it was just one and what ready. some for entertainment pull out a even like took sure after task. not always their movies kind of company that puts out. like oh plus now you just have cable whole point. you on one can it need to go into mom. probably just put them back you know about rest of dad,0,unhtrema3
3yQa1EAhglPH87xqtfQKmo,in their but also setting some aside every they can throw against out new advertising. not to stay fighter going get too old do may wake. what kinds of careers they and did or can fighter pilot. to point in life where you decide want leave maximum value. struggling with my purpose and would like to hear your goal is become fighter barrier. commitment doing years and it pays all at bills. in that get to point plateau business and often times. guys have military in real problem that you know. telling do not good enough no matter how hard. if do what know need to right now,0,unhtrema3
3yveWKAwSF6rONBwHtikMC,subjects for or doing few really think a lot more difficult. generally be a and specifically being head well that was an interesting. subjects colors to make sure that had an even balance. teacher to me and was so this in time where past is on know it easier. them up of day from all kinds for example. ways of getting around that which may involve meeting up basically. weekly then can see where fit in my work. be as likely to help you so it can make more difficult. role for when was younger they did read out than go changes. time make sure been you have people find it difficult,0,unhtrema3
3z5zWuMnniPKcTPymHRRXI,your right from phone or computer going to distributor. talk and to keep up with my you can follow me. or straight out of form quite a few times after being brought back to see. looks like going to be lady in upcoming plus series,0,unhtrema3
3z9Kkk9LNEH2TGkilqcPFr,speaking about talk little bit because he is someone. mean a lot could be said think for both of wolves. be exposed to often so left that kind of made sense for few got stuck. and really for think is the cause of he his a victim. little bit in case players academy aside from do you see. and anything else is a strongly believe that one maybe two skip. getting right need to have good of types players. to really struggle be able fairly judge. thousand pounds a huge amount in but is option. everything was and at time mean honest things,0,unhtrema3
3zir6jx2t64H9gzWjg4ac0,want to have and where you think that being is something in speak. to get needs met from someone else and word. parts of and maybe if makes sense like idea. way do you find that hard or is more important. think really stand out and to would say huge is. see it like many but more of romantic kind side. involves you letting your know going on and communication. back on what just to qualify your best friend. think this also comes down to because really that totally fine. or maybe that is something work on fence say,0,unhtrema3
3zkN09hDZfoEeX6IfVNbvA,to work building fire while prop the mother against pine tree. keeping company with for reasons largely up the goes. bar to call but phone working as black dog. spending at nobody knew where question master plan. going to get married but because they needed set. into three days way she always had a four-day saved for chief. once would do the rest was everything it had to be slow enough. leads birth to child with medical defect. reign of unique conditions that allowed them to seize control discover. plenty of coverage nearby to hide should something go,0,unhtrema3
40cQ1OZKNp9XhUTHa92mdK,sell gold fish out where know but like exotic sharks. mining and then your or helped to save you from falling death. long ago not that like less than half your life. on born at zoo that we worked or. job avoiding super other content that shows you watch but feel. to when was a can get little it. good point of also know much about fish for our like think. going to when like waiting in line get dogs. ones remember as why them because they were actually good but. him being an very thought it call to that idea,0,unhtrema3
40dECDdVVUcaV5Pq5Xlmye,say make it as his energy everything in fact. from and here to tell you about anchor the way make creation tools. even for queens or you from floor see if not the free. how always know all the young and that hot are smart. do that would be sometimes hit button see down pack. up - like they understand creative give my vision lit. need to get we be getting that course. count on one hand like who made videos with and. to know sexy or if too pretty for gritty. love everybody as and push in black realizing,1,unhtrema3
412MQ05nzDPeMOgXkULk8X,thing to do with sports whether it you know fantasy. can do that would be absolutely to truly everything. investment real estate to be going with the last thing. be able to see that with this you know working hard. can do free absolutely and they help you go. to have you know a lot of different guest on topics. guys and there are plenty of ways to make money hearing. no name looking for suggestions anybody. can respect that of this and enjoy as well. world as think that a lot of opportunity in doing platform,1,unhtrema3
41Tvys3MKcIU0cPNU7eP5w,to get them at in know mean for some time. to for sure and hoping again really in think. looking to future of forward. version of would be will a good fit for that one other think. up kick off addressing biggest talk in sports right greatest. to leave do think that the would be look. for little bit or you want to talk about sports comic books. make sense to me for man the go out. help he deserves and you think about money for. stuff coming out comic book know that you and game,0,unhtrema3
42PU8079HT7DvGmUwkDkKj,lives incredible chapter it lists out all the ways. honor as our thoughts turn and become really entire life. how actually every day in my practical life decision-making as one. we need to be people honor as are ask. we through and just to read but wanted in speaking. part give him thanks their hearts became dark. pastor in the it comes so quickly choose to come heart. see you next week for. everyone to our spending time with wanted us look at chapter,1,unhtrema3
434ngZNf4auA40eI0ZFjaU,to pick man think have best chance of helping rear. going to be like in our personal attractions why and year. if on or constantly checking to see who know much. ex of and it might have been because no parents lived in for me. say about the and we can have to create another for me get through not. once a you need me even next discuss taking big deal. think that always interested in men look. not to end up your why are you still dating waste. why bringing this up because sir have a thought. free time in world and like all those that will change throughout life,0,unhtrema3
43eFYhQOHILCTAi6Afo12F,with points bet sports betting up in world. need to know leading up that will be released on selection check. one would it so say for certain like and shrimp basketball. and then there are more important things in terms. both sides of ball and we from it much you know our go. interesting term because a noticed covering couple years. why the are now in tournament picture next question comes from went crazy. life whether coming to breakfast being on time see how. sets on whole level especially for his not very physically. to but alternate is just stopped in first show,0,unhtrema3
44CnUZ2v4d6IWR1juH2I2F,to when plan for my financial invest in things. from schemes quickly hard work grows over time read. lasted about hour they discussed her background shared screens to look at monthly credit card,1,unhtrema3
44iIxNU8wzmvoAgxMrPpuj,you ever wanted to start your own should use anchor. search for premium in or your library make sure to follow you. get back to you can listen all of your favorite artists,1,unhtrema3
452Ytn5Dn0blMW5ZvtoJud,then these two ideas not mean aluminium heavy metal discuss poisoning. if what is realize that the risk of claims. outbreak of flu can imagine bad when we have no real treatment depart. be why is bad if just up to for flu. spreading of information and that sometimes the actually feel quite powerful. protects the center who with measles. know about yet and just answer should go away. can make us react the opposite are very creatures back. be able to you between signal and the but date. question as practical piece of advice for who work,0,unhtrema3
45aQVnTm5m78jAo856S6Qq,be accountable to king would not de distinguished himself above administrators. his did whatever he wanted strong observing male appear coming from surface. human hands told is you to seal up vision because. at no king can be the gave order. to at a where read help you fall. fourth will be a on different from all rise. rebels full measure of ruthless skilled and will come to. administrators say went together to king and said live forever all establish. earth mayor issue decree in all my domain people must signs. extension of life granted to them for certain period time continued watching in,0,unhtrema3
45d1oaUGzLSiAF4t93e6Th,thinking or how above is really your guide to economics. to doubt the most fundamental of start are basic that we you know. away from of our nearest star called the very things. rise because we live in system of but. you know very much the all beginning. really matter whether right or if you actually go. say away from take more look at should up be. but in not really pointing up away from agree. in basic of our language and time you can have to be really creative. like you know next time look at try to take,0,unhtrema3
45hMVOlYDHoX0E92qKjKTW,conscience of king control is in words are the pieces. hidden and to kid get out quick cotton weighted used. for listening to major sure you follow your favorite never miss. with world map trace the line across small of your,0,unhtrema3
5CccnoO1WGVrT8YSiv3UnP,need to do is give point lock onto stick us. know what must be so hard to start actually not. once ready to start what recommend put on floor hands. to start moving want find path getting at smallest thing. very quick ideas you can add into your day in order. you going to become more and bones life right. as you possibly know that sounds bad but do little can. out and losing in all of different thoughts about your if doing it first. even worrying about like fitting it into my get up out. in minutes per day to start changing your life get excited,0,unhtrema3
5Ckw5dkJzTMTtrRKGEjjFh,grow you go to do know so and all my sales. going to say woman but in same kind of basically. to the like this when you know as she feels more comfortable. know really these are the things that everybody else would ask. talking so much when you know anything about tell me. coach this is my video coaching and the topic of going to in other. do for living you seem like really start talking. you and make plans with take your numbers just in case. your put sales away credit report. passionate about it because like my clients all the time,0,unhtrema3
5D5PIp1SQGtTtSNIcHwtaC,looking out to watching waves or perhaps sky. out through to more time in beach slowly. language allow your mind to we always remember bring it back comfort. free anchor app get on to and welcome first ever sleepy time. problem your watching it sink into ocean and big. nose one out of mouth to into for doing that until you hit feel. gold the creator of here to tell you about anchor. with rose please tune in tomorrow for full good. slowly raise back up onto shore and yellow red,0,unhtrema3
5E4itTs5AlfJkb2ifEhBNT,needs mean they put out anything people massive kind. mess expensive like looking for little work. eating some properties little strength in gold a lot of feelings. right need to probably doubling. know how is play out on but they can say right word. going to be so biased in but get. if personal connection to who is just missed at it. gives them more flexibility and post right out of that thought. of why we you be your may not know up. to miss me a we would be at wedding make sure you tune right,0,unhtrema3
5ElN9C6dXkxIDsJmo8AlA3,lot about it seems like just basically the common flu that we have right. with possible extension of in general you think should stay or do. our thoughts certain on topics throughout community huge out to all childhood. in back and you believe stand behind am all with best. on my literally out like six worst of bread. natural at certain things that this man does in broadcast. like it but thought was all right for time period. to dump entire organization on one man shoulders. drop out there is little like that probably should some home. quarterback is taking over not bad for running and just know playing,0,unhtrema3
5EolNUtoexjBBAoVj5Ppy0,to help those who need heal water in mountains. place you slowly when are can focus integrated back. are into high just allow to feel this deep healing. energy of love coming from as golden light how. welcome to healing for all going do a blue river in water. please join me in sending healing energy to the and. feel how light is expanding and you can. for the and hope to see you next time. filled with cells in your body breathe this pure,0,unhtrema3
5FwQJAdYq60tn39tfqJDTC,to still down am the reason that anchor. three things to help them make space for what is thoughts. practice with cook you know whatever it also like three and. it process or you any idea how to do long. with like getting book always tell people easy working. very to share think mean because you do hear of practice. and you know about is this do think. like love but gratitude and wish everyone well. involved balancing daily treatments and food was beating just care. in whatever that might still practice right learning how to,0,unhtrema3
5GDHyHd6rMLJEMhFutcLGd,relationships in future now going on through the following need to understand activities. influence me pursue that are like drawing realistic time. me to understand my mind the of teenager with global celebrity theater. unaware of actor who portrayed so expecting life to be altered worse. not thank you so much for joining until next time. of celebrity finding other and so did my friends,0,unhtrema3
5GEOY4fi9nfsayLhm2qW5h,to actually hire retired been in industry probably got a really interesting. from you know race or gender must role. my business so just think win. enormous influx of will make sense to you tons that want get. think to bring lot of value my four. to ask you like for bird that a little. me you years on interesting to of like ad world. of my most you as can imagine young company people. consumer but different also creating a lot more creative shops. you even though been retired for years in to worked at and,0,unhtrema3
5GF9sag5MsGgf4vJ7KeDgW,to the where each time we consider a bit of wisdom. not on own comment relationship pain may mental attitudes. experience emotional pain depending on how they frame. minute to give good review on whatever platform,0,unhtrema3
5GgPN5W11jI3rDOQDOsN8O,in but kind of feeling uncertain about the if into personal. inspire me really do you have open vulnerable. looking for initiative and was feeling very stressed anxious. beautiful welcome to name is got a be your host,0,unhtrema3
5GujnWH2rluXn1HEB5GEAm,going to be staple of content that through and mine. to do content have an idea on how it better beat maker. of explaining how want to see collaborate on something whether. basically content and then random as folks for future. so and of course which not that active on used to try. in can we do all our wild and kind. of just it at the which is not lie like to kind. of content that you we a know in community on will go. to be talking for hour or whether just wanted kind. to all that kind of is just going be want,0,unhtrema3
5HgghCc98bo2LiXzKy0F27,her and means jump out his whatever so then later on option. why we tell story about like when gotten hurt so. kick as hard can go straight into light comes down. gaps everything and like apparently he even take way. about the so like not too sure get. all the but love her oh no pull so work at right back. bag on our have we speaking for calling and believe you know. good stories will come taking my on spring break in us. so looked like straight was the greatest thing table. so we were the whole class for reason means,0,unhtrema3
5Hq1RVZ5SdjssMTv2e7b47,place of employment call would just come out pray. even though there may be times of that you whole. sound of my would be made stronger in name pray right for. insight understanding father to who pray favor. if it lines up to your that you would do for name. for new home favor in name of pray right. wanted to make sure that got on prayer call. that they would cry out to you o the live. pour in to one name of right pray. on week and each every one of pray right now,0,unhtrema3
