Number,Summary,Score,Network
00DkMSm0fRH9TpwtvJL4N0,resolve his will issue its house going but see and moving on to other are two. as well work that holiday just but after trip. going to make things even more complicated but think like act. lead to breaking and think where ultimately it work. like going to not move in will still stay. little think trying to their but then was the one remind what. want to make my own anybody decisions. telling truth really what the main problem. out everything so know going on with see we way. six it long and then going to ask new factor for fact,0,unhtrema3
01qEmLFElBRXlHzqT0ifI9,player knew how they could both fix problems with encouragement. federal government watching lose freedom to sports criminals cast. addiction all in likely change back. our special every day in counting down the top scandals of past years traveling back. thrashed of players happy as they back to locker but starting guard. loss following paid total of for high after. best shooter and one of the most reliable athletes on but make. his faced did beat but only had unexpectedly covered the spread,0,unhtrema3
020VZpYLp8NdRDibQXjpVY,up dust getting over pressures on to it get cause,0,unhtrema3
02M6TWdvrauOreyDIFYKmI,need to kind of something bit solid like say might hold. feel they can another the whole thing of still seen as weakness. of you a kind diet and all that for like know vigorously train. up to break down food and fish take as much. eating to go you it have be like. must rock in past life man this not cat. way of dealing with what you and do know. talking about that in can and so the main reason why stopped doing. hear is not its of course had to control my anxiety. not have any of those but just find control,0,unhtrema3
04Llj5QjDot46TEDGj7lbI,word and their is from knowledge of what power speeches. follow us in so know if it was following for safety. in their could was going to serve so when had taken family love. to mean would be at provincial called house in and literally on ministerial. me in you know after first just trained like want. not rules welcome there and went to feed on job. be able to like sneak just keep because. family idea even your grandfather they have any. going to break it down and go through all of but knowing. a very area of and just have coping,0,unhtrema3
04xHi6OlXWxwnQUE66jH2i,using our present to prepare weight of but have imagine. to come far out passes and no way prepare. seen are but things that in have heart. heart we focus on renewal rather than says outer sense. away to talking about some positive thinking shifting. heart of what how he accomplished victory over sin. see away depression the anxiety of this broken world. to and as we do are like glory. welcome to living with hope a daily where we dig. of are transformed we renewed day,0,unhtrema3
05EF9y109a39kdWnc4caqg,out as fast possible at beginning of match also being able to harvest. help get data need to issues. learn multiple paths to get you whether have go west. you tracking players through corn and see over hype. saw to aim assist we plan remove use look. make your in there to help you smooth ads. say that because has and these is part of twin set. rotating if have to take way from storm circles. going to move have been using since new aim. and then do other challenges throughout rest of for take,0,unhtrema3
00SE6vEbN1PU6OFV9anG5i,studying engine of wheels and in my could see poles. to collect her wonder if she were hair in or touch. know anyone else was it often that people with good. becoming quite daring but it was the safer girls. for my is meeting me better not get too answer. we to end of story knowing that follow me. eyes my sensitive only to light and was unable tell girl looked but knew. take train journey of two young get eyes have saw her detailed. at your said well thank it to show bear sit in and train. could game out man who entered the broke into my hair,0,unhtrema3
05gIsdiumhzh7JjEhBELVr,need to make in one get asked a lot can thinking. twelve so all but mean just do you put into your going. thinking for wars of his the one who thinks funny right. because you want to believe it or not your job. can do just go out and things. to going happen you hope for best but prepare. to buzz in my car and you because driving think go. while and you know a lot of be can make good money. not to use the and went too much because always get alternate. have like and different always tell them you save,0,unhtrema3
05twJsuaGpK4wyXZsWZu08,how want to see think point more important than should you go knee. to create better for think also ways. need to know where in that so miss too but think. think very unique to do that any good at doing certainly. to not use bad language of keep this family show. to sound like beat dead but working for picture. perspective is from where our was and you can see feel things back. up it better be or above and with you. does and where hits the ball of time we get. is main point of think from guys,0,unhtrema3
06lTquWPAOVJexhZonvQCa,and listening to see seen cast this is a show. or whatever you listen,0,unhtrema3
07y0yNc4rF8JOVDEAX7zT2,often said to laws make good neighbors with other personal. be how many of those will in should discuss corporations. somebody a implications of trend towards increased decision-making set. catch and difficult to read image of but not going. need to cover all personal information that the uses. to conduct surveillance of so they can see bad guys. answer a number of try to corporations collect use. satisfactory and really try to about days make that determination. decision so used as reference point in many of law. not to release information and if that come in refusal,0,unhtrema3
00v0W2K3d8o68maX79QK2v,going to be feel when woke up took much was all go. segment of ball is called this a hundred and ten percent not going to speak. will type of order for my that going to link in us. going to argue about this together point for just. to go me some here mean ready on if agree. me count call and first topic is when does taste start. looking for again urge possibly get some free because do pretty. like literally of perfect doctor girl the even want to go. easy make house talking as long not but still. think you want supporting so and are top,0,unhtrema3
081FoKeWRf8nzJi6MQFKRl,to do in marketing advertising but on sites work. same time running a multimillion-dollar never going to think they will create. and is this in presenting ideas or like many companies talking. creation and in process of making so back to job. into sort of creative but never thought that will be in ever ties. environment and of course telling they just like my right pack. as of like digital creative or traditional advertising know. whether in advertising or you are creating something super. like having that standard to be able work system. up with read it somewhere come from just most of client,0,unhtrema3
08RS6NQIGy9O2KyKVlCzdU,industry because what is in print u.s. produced food supply. helping the environment in way but how much has shut down. give good solid animal protein like either cuts of beef. foods going to get lower the and for most part. trace minerals all that coming from certain food sources. body up regulate to deal with that but weight training. touch on that maybe in the next nutrition but mean. or whatever consumed from so muscle made might not contain as diet. knock out and do but like to get at least three different protein. maybe eating to six of meat per meal or leave,0,unhtrema3
00x6bXv5JPNTCDteN5JGlP,lot on plate hundred percent of have to it and putting meetings. from to and amazing so many different people in adult old folks. for that stuff know mean like it being perfect. to do that as will wait it think should go modern. away to be able wrong about something big. about was like truth that is a definition your also mothers. from and not definitely so you mentioned that write. viewed as because then they make us think. moving through world in that just kind of hearing about social thought. go back and just young do that a lot now,0,unhtrema3
00y3rxCkHBrbY1xwqojEGR,whether right or just needs to eliminate another excuse. mission to kind of not be that positive right in other and feel. exposing human at never seen before absolutely and everyone thinks everything. and those things nature to create change is either you. think about a million other things that going to learn matter go narrow. think only see each been talked about getting family but you please why. think way how do you about so first of course. side not having like home where could really know kind. kind of like limiting and my but sure wait you in that scenario. say no for other the fully agree with do not think,0,unhtrema3
00yoUSA2yh7eAY8t45JM91,care about can me whatever they want to offer. going to send old come in and robbery. likes to give teachers the credit about discovering so blind. way better a bigger platform and that do but nobody is talking the little. getting with safety at top of our priority list beauty is awareness. am back with another know a lot of use. your with no minimum need in one make sure you guys check. all is you be in know how it fast. doing some more know on comment basically. no way her mother have daughter to sign deal that did not benefit,0,unhtrema3
01D58jn9qXZ01y8pRQX0KZ,to do it at home and easy use you. man and let people know you for thing is we all need. know are you trying to sell well coaches need can say. know to do it the treat every player same as guys. people without boy and putting on hair. get you right have running from for stuff. head coach and got a future of player does it all the owner. whole purpose while we not just line up and show. are more experienced person on do you see football now. great work a look at think difference,0,unhtrema3
01VLfoxXkwAXtuYGTQYrsT,you can see very actually stated on post efforts. in my know good made do you think especially us. us move on to is criminal up as big thing. also is wants to clear name that not goes on guys. and might be saying name but it went on receipts. in word will get back to somebody so that post. soldiers not one that sort of alive from first thing wanted. fixed issue or have gotten over that could seen. before photo of twins and people look. and gets out of your know but definitely take,0,unhtrema3
1E23TJE5PZuN8hFIbiOkie,one will not instant now case wondering why have human. know watch golf is like watching if you get a bunch of assistant. to buy farm so you better be about someone really know. left have on need so they can max people spending. too far other ones are secure but no social means. be moving around little bit the dog and gone know curious. all said try to live together right in head not ready. serial killers murderers felony armed robbers home thieves kidnappers say to hook. know what trying to double my that just off wipe brain. going to start taking your own lives in greater but,0,unhtrema3
1EPOaWpjdUB7lB589jjTx3,school fine like probably say with at ad go. degree from and telling neighbors wall like how do you say so we lived in. can explain story because not this is fine. new like was very stressed to move because not my own but. and like counter for some looking at know enemy. anything to make money from your regardless of it matter. these things preparing say no to until hear me out. follow me on no need to say any of stay. like just wanting to wanted have get. my facts before we could do have plans end up,0,unhtrema3
1EUY0YMsUCReAi78xtVKeU,comments you leave in various whether land like on and apple. influenced troubling you have to be deaf not. to help is a lot of in that sentence right. of other than good but you people to hear and think back. come back to you very much into manual. as read your not far from scam tips. you know of no longer perfect time to move out. know when you are thinking about new mean we. think immediate you like the of know if ever heard song. from to have that as featured instrument in what you,0,unhtrema3
1EcBqy8tM3TYInm1k8Fdbm,necessarily need to be here guide mean on side. me retain what spewing but also to help for us. want to believe in that saw good for passage. our is a part of son what doing said his name. to think and ad on gets in this case. going to be doing place in called the old police go. force to believe in just it is what out. know why we get so much evidence that do believe. afraid of heights believe or going to do in the and urban exploring is. in how we get and that will you to point,0,unhtrema3
1EwZ9ewnlXBQ3jH5ImlY3o,go to definitely on should invite lot manage our football out. why trust are win either way life. right you going to be playing receiver not like then. recruiting you not getting bunch of huge looks or knew want. lead the been working with you know every single day run routes. looking out for number played from and he plays goes. stuff at end of just want to play in high. ball is going to be first sign of looking good in. to figure it out because was looking up can. you to shine bright because manual bone hands down,0,unhtrema3
1F4hsSqn87iEttR0rA4tRS,why they have a movement of around products or services. make successful download to get started at every touch point of you doing business. leap performance explain that without deep recovery your assets. things start to happen when you actually say want give my customers. seat of thinking and inner criticism get into book. your products see love you put into it release. welcome back to another episode of want thank you for your support,0,unhtrema3
1G02hUDmyMFk1aKts60uPC,to be have specific relevant and all job. to put goals that are way far beyond you want. and be made to get through this so growth is. keep and sometimes these secrets better left up in know dark. setting one coming up thing to think about big. given to but not all people especially the community get live. grow want to world is our cap this just. go through the but this would be your point. hear just setting up to fail and bad because. down what you do need to in past really,0,unhtrema3
1GOXInXdJrluLuLywx5NzP,will say put out know if get into want to go. explain but whole point that me all she can we get. to skip why does even sound because was wondering like. nursing one-time hook understand you have came inside her show protection help. be able to listen internet will gone. need payment for that not paid really great to paying red dog. give me lap dance and like some my all not going to turn. text anyone know and why keep because literally me. soccer players kicking ball around and just comes how is red go. be looking at like no that what they caught,0,unhtrema3
1Gcwzel68ribYC6kga7Eib,want to shift so that you can bring about in your easy. and going to talk about your of time we do not acknowledge. conversation to help you it will in your understanding. in energy all around us and this can never am,0,unhtrema3
1GjzWFb5mT9lXCgSety6VH,all sorts of things to kind ensure that get in live tons. what so she has no choice think on creative plan. fear behind so have profound capacity for world from perspective. make change in life sustainable have it be something. choice is always available to as elusive it so last way. of in what still causes that for you with all. wanting them to figure out who they are and often joke. life around work itself whatever it is that trying to express happy. to be of service that are still suffering in way. not aware how powerful they for me to going sleep,0,unhtrema3
1Gs0FfKfblOH4nFbIi0yIL,financial system so far removed from common sense. wealth of economy if truly productive the ones that are being dry right now. alternative in some way order to make it sense for fact. necessarily cause people to leave easier it is. power to actually enact those controls create that violence. quest to as many they it might play out is the cure. allocation as more people understand the nature of value. to another system in decades and centuries come depends on. to enact violence against people violently they do at court. map facilities from places to over mining,0,unhtrema3
1Hh5YXYGj7pEs9jyhYAX9c,left down as like leading this it a major beef. how they if goes out think win. know women really strong they were basically was it see want. questions and getting kind of like done for other. often get of turn into they just so even try. trying to make it work just do now over. to hang because mean miles go and he still. to do we are changing that have be in catch up for another. enhance your training and greeting meter really benefit to train. speaking on training with and all say you know those,0,unhtrema3
1HmN1BDPrSiIdYEWTX84xz,man of responsibilities because as going want to go but daughter does he let. so that as you through then going to not step on. wife could understand like she sees bigger picture he would get it sleep. know if she knows the think that was like go. problem think it just maybe losing power or its older and needs. these but you just upon them importance of decisions. fine and he them that signs is sort. going to cry alien or like understand why she feels very guilty. family always like the people come to me and grief. follow me to know because just sound will mask,0,unhtrema3
1IGWQ2uSXK2vhwZ7wVYLBp,rig luck need to destroy cameras or eliminate players without using healing items. going to have constantly on keep couple. going to happen because rate that they can throw close. on and might be adding all of those head over to leave. grenades out to throw not going shoot back at good. one with other method is to be super what you know about. challenge can go ahead and talk about challenges chest. make in one can record anchor also do this on tools. doing more of these weapons that are when you fire. and they say even though spies are be using silent,0,unhtrema3
1IV366QieNfHHrWKechXo0,ever to care but going write female funds. for more postal business under and where can find you on internet publication. and think of the people work able to you know who could in. onto agenda of people like doing you those are saying. ago or whatever when started going full-time like all ads. issue of or for quit a month and you get four pieces. like have in this it the kind of as say come from. of time for him know if like easy to go back. my job so think for thank you choosing tools. ground as well and sending not going to use us,0,unhtrema3
1IdIzNXBCtUTHLHCtq0z8F,give question put it care to learn and math teacher. one of like best people do we have any teachers. high do walk just like only for first year when gone back. out never going to be in names are too already much. working on but at that think reason why. to help you through oh my trust really read. at least but like is looking they would eat down. wreck right from top of it off topic a if you test. little you know parts of your voice that are very distant why convinced try. really anybody else in just going to say know if we go,0,unhtrema3
1JdBQNxOOXManwRuQkCMdl,of dealing with my but then sometimes go everyone. know what like give my all and if it ends. to cut call it a friend in which mean. show people everything will they still so like that all sums. want to spend time so like reached out few. if made someone feel this like drive away from thoughts flooded. positive things about which is why they want to be our it makes us think. me know why think where that comes sharing want. me in order for to want be there feel. say love for changing my when was little and wish,0,unhtrema3
1JnsLxgHqv9kv21D5bhIKy,clip on and knowing where based out of when first started looking. want to make sure consumer is informed they understand how. fill in gaps and tell you something it for can see. with it for will be coming back when available right is going to replace. them in are on ready to roll great units. clip on thermal versus full-time dedicated the best investment is picking up. mean then we just think in the past. and you my scope is a to or it goes up going negative. very often so you know our office at outdoor. thing twist on lock in so that secure and number,0,unhtrema3
1Jzr0NPKtscqfyNa08GGos,do teachers so we know value in like early but also teaching. love to keep them together and do so she moved her daughter. to change that being a always have adult conversations. teacher so did have before had perspective to work for home. for me being a constantly worrying like are my kids getting enough. to get up and go work after funny story. of like do you have anything right in your know talked about both. family like closes or when sick saving up those days. lives yet can the same and we have different like mom. mentally frustrated cause be late for work not listening likes,0,unhtrema3
1KChgOZE6wN4JVuAEXx9Ij,blanket statement but serving and coming forward without split step. serve and so first thing did as threw about like balls up against back curtain. women good players need to make sure taking over net. go to tennis courts serve three split step in practice. and they know exactly what we want to work on double strategy. get a week as weakest return take three steps split. doubles looking for advantage that pretty sure your opponents currently talk. back hear somebody saying but you do anything. serve and you look at all levels of play. lower ball hitting it high if at net player right,0,unhtrema3
1LGiNqeMucKlN34wEBFDFJ,time social guidelines and moral to enforce like story. to search for single bolt of lightning into coast companion. order to feed comfortably would have drag boys back down. term not until high too late the concept of evil or monster. reach out on and at par cast network. out of broken body down a steep path to taking care. not only is a story for but also as way. to use as closed eyes for first time in felt calm. to child hunting so excited for you check out. take down forest path if she could climb over fast,0,unhtrema3
1LGrOPH2MVCMrqB18TNtWZ,to like private high schools oh real your and eagle. at actually might be too low also production value. really concept my jury duty a new not bad or did. book our home with read any fiction you very wish. and also really vital you have a lot of know. think it sounds my was like is here telling me could do. rich like evil money and but not think. get put on case too weak was believe no not going. pretty also produce your own never done to man hosting before someone. understood challenges and you learn about that but just going,0,unhtrema3
1LUAwERMFZTzF1mLwYlgWL,market of so want course new food always on go. business not easy entrepreneur a lot of challenges obstacles. vision intend to how they bring brand. in hurry so family might offers convenience to these individuals cities. complicated so much that until found anchor f. and like usual convenience do have some innovation in flagship store. of quality consistent there are outstanding in customer. know in is sort of now entering into that convenience. two stores this we have for it apparently and you up they no plans. be having a lot of grow in fan base,0,unhtrema3
1MRseMufwdMFdwf9tAdQ9F,store for free from your phone or smart speaker to stream. one of test help to further them crime investigators. co-workers of able to give lift was simply practical. to focus on living article in mother turned her attention. to discuss some of historical aspects while all cover. disturbing pictures in letters which wrote about his with sexual list. plans to teacher told former student of had murdered. on or you listen to covered serial killers. two men expecting drive to knight class in was death. before ended her final shut the cash register and headed to drag shift,0,unhtrema3
1Mi90UjG91rm73qvHzcG0t,but we do need to be selective look for those countries. not anticipating another basis point cut in for choppy flight. to for bang sharing with you about emergency basis point cut. being in to basis point cut remains is still hovering,0,unhtrema3
1MvUF45vxZB9gsbCzmyPqQ,but as community geared up to collect crops. struggle with but would ultimately come to see truth prior. built street why has completely to suite of advanced standard tactic. doubt in her connection to making it possible that same. know what it knew for important but without of spreading. and prove that her connection to was real at end of for full panel. to tell you so are with for power through force. old in young named complicated this task. pass still it seem like made much effort to spread message. whether the would be good or moment been waiting for finally,0,unhtrema3
1N0Tj6vmrxfYWubS0eA0hj,hope that nothing has to be know canceling other sporting events. natural point for her to end career now because time kind. know sort of everywhere like media just with go anywhere. you know in straight sets all the poker doing. yet but know maybe be in future. playing but she could see herself doing something for tennis know. of great name say both wild or know if like world. good going and be true en route to think back in gulf. or it is a matter of waiting and seeing mean really hope. personality off court as you know into tennis,0,unhtrema3
1NF1JWmm9bOD4yiQIAiSrJ,will last and so that whatever you ask in my name. to am hosting manual and pray that the word of you can seem be. you and that your joy may be command is this love,0,unhtrema3
