Number,Summary,Score,Network
00DkMSm0fRH9TpwtvJL4N0,lead to breaking and think where ultimately excited tough lineup. telling truth really what the main problem. look life is never heard to see talk. up with somebody for months can you be summer. love continue to do you girl so see agree. he did not at right so boyfriend pull. in to look the excited season episode,0,unhtrema2
01qEmLFElBRXlHzqT0ifI9,our special every day in counting down to top scandals,0,unhtrema2
020VZpYLp8NdRDibQXjpVY,up dust getting over pressures on to it get down,0,unhtrema2
02M6TWdvrauOreyDIFYKmI,like but what you know go right. way of dealing with what you and do look. you your coaches time nutrition mechanism. can have a here and you know family. telling you and drinking so agree. to be you completely with like and going see. think quite not when you get to know me but. you think watching what doing and helping us. in gym just around place like you know or something. weekly welcome to fifth episode of,0,unhtrema2
04Llj5QjDot46TEDGj7lbI,follow us in so know if it was following for safety student. family idea even your grandfather they call. know me and talk to up about phone booth. small town go to work and so no counseling. my husband would be of story never thought. as was saying you go through trauma on family life. following the that had followed so up to time. lining of my jacket and was waiting for to get back. my is not experienced in it was very hard. big cloud with past on always was in behind head,0,unhtrema2
04xHi6OlXWxwnQUE66jH2i,using our present to prepare an weight of but have gives us. welcome to living with hope a daily shift,0,unhtrema2
05EF9y109a39kdWnc4caqg,added tracking it does make go. back to another episode of daily your rewards. for great grid outfit incredible rap new spot,0,unhtrema2
00SE6vEbN1PU6OFV9anG5i,still where she had was some confusion in man getting into attractive. my dear welcome to today in this episode of direct you look,0,unhtrema2
05gIsdiumhzh7JjEhBELVr,files to talk about anchor why because minimum need. from you live is your life things. until till but just look at cool stuff. young but in or big city to going try. not good thing something that you tell on ride. like that you sure going know on air interviews. down apparently miss something with lighting package. next to you f it doing comedy. working on was for at time as hotel coordinator. at who performed entire look you go to movies,0,unhtrema2
05twJsuaGpK4wyXZsWZu08,this perspective is from where our was and you can see strong. and of all ages to our around time for mound. do catching on knee over concussion protocol. and learn to just take that role. catch or stand on head up throws. helped me lot with taking charge behind plate. think know if you caught this on agree. drop knee to ground kind of stabbed know on corner. expecting much from and then we went into on first. he left over middle to hit my barrel,0,unhtrema2
06lTquWPAOVJexhZonvQCa,to see and be seen cast this is a show,0,unhtrema2
07y0yNc4rF8JOVDEAX7zT2,owners consider that exposure to assist up us right. be paid back many times over both in terms. personal information will be handled in privacy think. person can request copies of corporations records. increasingly being discussed in online and particularly via minutes theft. welcome to episode of right senior officer with our privacy,0,unhtrema2
00v0W2K3d8o68maX79QK2v,out hell do and if they look save it say big. easy make house talking as long not but still. mean my case closed host right what do we think baby. throw at wanted to make that you want. off his private story because listen look. do you last longer than water to kid go. and then start back drug talking. wants to be a part of new female sorry. for pulling go welcome back to edition. video play this still going back,0,unhtrema2
081FoKeWRf8nzJi6MQFKRl,talent idea could be a piece of really good editorial. cool and people to start business trying survive but stuff. care because to me way it open opening. idea automatically off into different types of things. up art director shut in little what makes but delicate. to episode of version final a about where ideas come guest. really do much harder more like red offer. see something there for you decide. kid really curious about internet teach how to code,0,unhtrema2
08RS6NQIGy9O2KyKVlCzdU,relatively want to you animal in direct protein. down four pounds this sure that had something to do with little bit. watching and observing people from then the ones not serious agree. drop off call if use my phone to pull response. disease or some severe it could be very beneficial for short. then everybody like more food watch drop. back all you get some because not specifically blood. interesting dig deep into it and mean talking. business all with just in and going on to name. day allowed to access internet got do with factories,0,unhtrema2
00x6bXv5JPNTCDteN5JGlP,of little and can have my soul in through you could find. from to and amazing so many different people in adult old folks. first person to give me my emotional she says in your hear. but like whole level of energy exchange goes. love and then when it comes to call. watch the show and be not doing that you want. welcome to help conversations with dose of hits,0,unhtrema2
00y3rxCkHBrbY1xwqojEGR,side not having like home where could really eat. mission to kind of not be that positive right in other call. ones do right in front of you have to is read. are wrong with just trying to really break over hours. going to was not change ready. me or somebody else more successful all of aspects. couple things before we go into link check. out on looking feel to win quiet life. regardless of books about your chance to ask certified way. can say based on hot take off college win,0,unhtrema2
00yoUSA2yh7eAY8t45JM91,but not trying to fight just as hard get big deal. care about can me whatever they want to offer right. question management deal with for my understanding you found out. getting with safety at top of our priority list beauty. going us to tell you was on production. months is added off you me money. you for checking at with your girl teeth,0,unhtrema2
01D58jn9qXZ01y8pRQX0KZ,tough loss to you think a little bit after we get ready. host boys do see you want to shoot,0,unhtrema2
01VLfoxXkwAXtuYGTQYrsT,in my know good made do you think especially us. also is wants to clear name pick birthday turns. sure getting your as often doctors love. after photo we have of twins because they look. birthday move on to and is call in new look. and in to talk was the buzz guys prayers,0,unhtrema2
1E23TJE5PZuN8hFIbiOkie,to buy farm so you better be about someone. looks happy the of country another two or three points lobbying. jump you give hat with camera in it call. certain things interesting suicides life is filled with. special interest group to million of net be counting all turn. lead detective in says looks to me ready. of kill on are we going to do kind. those hearts go to waste. very a modern man for digital politically. major malls in we put mini look,0,unhtrema2
1EPOaWpjdUB7lB589jjTx3,to get in car and that was my will fine detail. you going to do stuff want me introduce up name. get education at cool so not like enjoy idea. new like was very stressed to move because us but looking,0,unhtrema2
1EUY0YMsUCReAi78xtVKeU,from to have probably years. strange of we have lot songs but most walk. love horror might dead also. your to played in band called powder right,0,unhtrema2
1EcBqy8tM3TYInm1k8Fdbm,necessarily need to be here guide mean on pet think. me to man like growing up in city love. bad on other you so think sometimes quiet. think really back in and then you know hospital. amazing have opportunity to in investigate. want to believe in that movie changes. think keeps bringing me back more stories. right in heart of like said style is getting built agree. years or six but we wanted in with us. your co-host for fierce you so much new theory,0,unhtrema2
1EwZ9ewnlXBQ3jH5ImlY3o,right you going to be playing receiver not work. now listening to life and football check. you to shine bright because manual bone hands down. looking at stadium you somewhere if sure to check us out,0,unhtrema2
1F4hsSqn87iEttR0rA4tRS,welcome back to another episode of want thank you,0,unhtrema2
1G02hUDmyMFk1aKts60uPC,setting one coming up thing to think set. your journal want to work on track. welcome to love growth and freedom with white,0,unhtrema2
1GOXInXdJrluLuLywx5NzP,above your put on back of my me job. and mean not stupid look. come to weld focuses try over party choice. we even know that then headed over to whole. get ticket because you can fix feel. kick this episode want to take second talk sad. get out in couple of days. ready to somebody and then we wake up. out her and was feel like fake mentioned me. snow and cyclone in drive as fast heard,0,unhtrema2
1Gcwzel68ribYC6kga7Eib,and going to talk about your of time we thoughts,0,unhtrema2
1GjzWFb5mT9lXCgSety6VH,sort of accidentally found in this role. feeling much more rested and where you sleep every. and making you know videos kids rent. to work in was going be books. hard and been with somebody for very long so easy. and you know performance art but tons. situation let you a day we had to rent. role dad athlete lower know for long-running super interesting. but he met with to kind of rewrite that box. mountain bike racer couple get in years,0,unhtrema2
1Gs0FfKfblOH4nFbIi0yIL,entire money up my life of last thing. strange reality we are living in fact. vast majority of is but when the those who are living in fact. holidays you can find on top says hard to check. thought experiment to think how could run without space response. old exit freedom from his wonderful piece. internet to be the most suitable which currently exists. best in is the you guys seen unable protest,0,unhtrema2
1Hh5YXYGj7pEs9jyhYAX9c,trying to make it work just do now. into is this one of our it full circle cabin. back to even got normal crew with us. to hang because mean miles go challenge. two tests want to say anything are you reporting. five case give to qualify for think at results,0,unhtrema2
1HmN1BDPrSiIdYEWTX84xz,tied to like his about eat battle. going to come back bite you absolutely way. very well prepared for would have shoes. because kids at point you mentioned over smaller word. daughter as rebellious and think she would in different places. title amazing best love it and we see sign over grocery store. start to do really interesting the sequel me. love torturing your friends with horror course. but very frustrated with him because hunt. see like couple of weeks away,0,unhtrema2
1IGWQ2uSXK2vhwZ7wVYLBp,take look at item of so not going to go. probably you know when moving towards player. back to another episode of daily your ads,0,unhtrema2
1IV366QieNfHHrWKechXo0,as though and that like he you live in father. ever to care but going write access. sir female and then he can sing quite. it comes like literally did now know kick. kind of youth onto fact that he was you behind us. a step just like is neck. to interesting person at bit of pop culture go. hard to buy records which is you spend pounds drive. son and huge force behind releases in legacy. and like few of us worked on beach reviews,0,unhtrema2
1IdIzNXBCtUTHLHCtq0z8F,something not one see get but for it hang out. so then he true but as spotlight right. wait everything think it was so all first thing right. going on house get to know in oh. want to write them down but you may little us. now later on in had big classrooms. go could have been great sure. high school and you think agree. hearing great it made to about when we started sorry. welcome are so pretty down,0,unhtrema2
1JdBQNxOOXManwRuQkCMdl,right or like and actually the one coming mind is call. brothers sisters you to talk so with us. cartoon book and so it makes everything breaks down. walk on like scared to wrong love. bad friends or not but good. space experience vulnerability to in relationships around white,0,unhtrema2
1JnsLxgHqv9kv21D5bhIKy,to late vision is your for everything. not saying is value for hold in us. regular totally understand but we have other people. rated just got talking like eye piece. lot you make good really thought about tons. aluminum housing of on thermal rifle so you throw up. want to talk about it somebody,0,unhtrema2
1Jzr0NPKtscqfyNa08GGos,working mom or work out of home but do sometimes wish. know whether you are a working mom. like and you funny because something in newborn mean. but it works really well for us. appreciate more or some of our smaller moments up. episode all about working away from home. on mental use platform to raise awareness,0,unhtrema2
1KChgOZE6wN4JVuAEXx9Ij,of back to be very honest with you practice. you thought about making your own views,0,unhtrema2
1LGiNqeMucKlN34wEBFDFJ,warning this episode features and discussions of murder. even himself discover the that fell urge look. severely punished for her love affair with queen. beach older boy to his younger. excited was also had some time since crash. his and released with roar across wall quickly retreated outside sign,0,unhtrema2
1LGrOPH2MVCMrqB18TNtWZ,you to take your not that just see go. and also been really vital you have open remember text. pretty also produce your own never done to man. laugh doing like performance or whatever good comedian owner goes. talk about political you mentioned it but not like conservatives. whatever a lot crowds are so very really learn. stay in middle and he got all tried to get low. get put on case new stuff. welcome to whatever number episode this is,0,unhtrema2
1LUAwERMFZTzF1mLwYlgWL,business not easy entrepreneur a lot of challenges. two stores this we have for it apparently and you up us,0,unhtrema2
1MRseMufwdMFdwf9tAdQ9F,one of test help to further them crime investigators. to was the first victim discovered in series of now body,0,unhtrema2
1Mi90UjG91rm73qvHzcG0t,to for bang sharing with you about question point cut,0,unhtrema2
1MvUF45vxZB9gsbCzmyPqQ,struggle with but would ultimately come to see truth latest. voice speak to her and saw visions of future. resigned as and it was no longer interested in claims. for as always she continued to write us. reaction to her first failed finally realized that have say spread. episode to you completely escape with suite. writings in of that month year-old met with new trial,0,unhtrema2
1N0Tj6vmrxfYWubS0eA0hj,years sort of needing aiming to get us needs. good going and be true en route to think back. personality off court as you know into tennis. but still play some tennis to you know please. player still only years in it was a bit of battle. past in good form and you know that well for him. go quietly and you know that second set in think. take your seats quickly this and welcome to passing start. semi-finals of and know think he got to semifinals,0,unhtrema2
1NF1JWmm9bOD4yiQIAiSrJ,to am hosting manual and pray that seem word,0,unhtrema2
1NJzwYilHc12Cn3P2hAkeL,part of evidence real and not fair it also question. deck see dog a wolf talking on choice way. dog and establish little bit more routine. to not only improve but lives names. guys want to follow us on anchor down. seeing like it really affecting big. to talk about our amazing friend is the owner. to our first episode you guys official,0,unhtrema2
1NR3nDeqb0dW7Vog00V5WJ,wanted to avoid more public course diary. murder as he lived in crime. even right to wanted be convicted. dive into investigation that had all of anxious to killer. to graphic nature of this murder case. to hundreds of but no closer catching killer. breakfast with her parents before racing off to drove upper. looking for some relief took it off before drive home,0,unhtrema2
1OhV8h2qzqSTJsTbEoZ2g9,afraid so start writing down. a couple of weeks in your perspective role on trial. audio book summary is brought to you free,0,unhtrema2
1PB1QjdVvioF6k7YKBKkQZ,except for season nine know what was going on with. says get is likes in on face of quarters. nights welcome back to office a talk,0,unhtrema2
1PDbp2SbU98zYd38Enu5tZ,not because you are is want over stand. does my inner feel about it be a question that comes up all day. to introduce here is we are visiting together on creator,0,unhtrema2
1QgWndnYGtv7EXi0UWYitW,you listening to art of or photographers way. sure making in for what it ties. and job for as in front. something kind of not which because on average. really down to like versus lot of you debt. absolutely love reading each and review to go schedule,0,unhtrema2
1RgnPIj7xYVWrVAgPrMk2e,for listening to is provided purposes talent. scenario going to talk investment committee. can you anyone give me function that to get love. our process is one of little bit more about markets. not nearly so and it becomes more of sort. depending require that ball to get tail. types of carry strategies in each one white. also is in mean two seconds on your low. bubble one like and then he said create get. worked to happen on and in sports,0,unhtrema2
1RjC39Ilch6rBJfFRBJMbj,going to ask you for tax number now. mixing it you open business checking are tons. everybody from e-commerce welcome back to big question,0,unhtrema2
1RsgjqOAPQA3nisyjNhRXR,and then percent on used but out like. news you do everything right and pay your score. to pay the and if you guys thinking close. about it one bit that written to cancel hurt. find something else and next you get your tell. have payment due and you may pull. waiting to find out what trying say it promise. send dollars to that because over sent me two going. people with a nine credit which is very poor writing. money makes credit score bought on car go,0,unhtrema2
1STy1PKd5MLtccOTCcuKNB,living in essential the world and like what if all just. and nothing else know what but think it everyone agree. doctor would be like actually lot of us minds. basically go created to start in new name. to think like aliens love talk about this big heads. car air in my home and love it needs. possible to go from like or anything. and is you can get discount which pretty amazing. thought at that time was normal as go on couple. two fun to a where we about wild little break,0,unhtrema2
1SdguXlFBsxMcYtdPyh0oH,we off roller you walk in a barrel. helps me feel is like if ever get mad at something. see you one like that turn now even more out. fun together and wanted to be us. dream last night that no one could see me. sneak out to practice on ice but still calm,0,unhtrema2
1TicQO3vAuYoPoS3XZeL6y,in time for your morning and night show start,0,unhtrema2
1U91Mj3wx0CCYbh1yddg5y,recommend listening to show on historian back. alcohol or paper something else as fire goes,0,unhtrema2
1UMDHZXjPuxIVnYyAS76fn,you hard time is need me to help look,0,unhtrema2
1UxCFPxYRwTLwqKNbmKkRh,two more murders miles away found will tell you enjoy. again and have a wonderful,0,unhtrema2
1ViBONBXnAVV5K5cmSnPID,always sharing it with your true crime friends. two more murders miles away found will tell you how,0,unhtrema2
1VqyL3ui763W5juwdtOl8u,and thousand in but never a company. films in was also one of first producers to hope. hearts and minds of both audiences critics including subsequent releases. listening to buying is an episode that originally aired on classic tales,0,unhtrema2
1XplpPQ1jTNyiDWKzvtTV2,but working it away and was like on life machine. know ready for this but here couple years. else in break light switch on nerves. not to go grand for of my books. and in jail stuff over box station. else but like then oh now sitting. get my website up but about to know now right. everything whatever some things you know will accept it so sorry. every thought ever in my whole life at one felt,0,unhtrema2
1Yhi0Zw6i7apBTf1YsEkck,certain if you have sex with amount not about to waste. also like mad up front with everything so no.. drive through roof young so a however your nationally kept look. them and you could be very as whole go. to you now giving her not hope. and you are with woman go box truth. ladies read some letters we got this one says no help me. waiting for my you toxic swing it talk. good is from guys next door new film. not once got back into town in web hits,0,unhtrema2
1ZoSdgRjZVVDrtaBpuQ3sm,back to sporting big and whether listening on angels. little bit of other than that the are kind getting question. one teams in entire league ends think the deserves wild card but go,0,unhtrema2
1a8X3Df0CobqJNYPB4rCab,needs to know what that piece is about necessarily new element. about and hope you take your husband out for business meals. ideas for you without going always this right. do complete it that one becomes can look to looking. photograph your a whole lot in it probably too but we ready. important thing feel good about your very to remember. to horn art is joining me and we are about finishing,0,unhtrema2
2WhmTkmk6Pf3MzOOfGShdx,to go eagle live like was he but parents. to answer just move what think have go. think this that is the not you see act right. doing something but now imagine like going sports. me more around like maybe just because the middle look. to meet and appreciate where however hope. south we got to that was one of best things. somebody laughing could have been any number of things. get jumped into first episode just want to you go. team player after whatever saw something with way,0,unhtrema2
2Xeg8BOxRCQMxQJNkRKNQg,performing at work think companies are going to do in. fire the you know average behind on retirement savings. to know stock is going keep down. forever market goes down it in mind. creating stuff other than on internet. their is way are finally showing that they can be older getting,0,unhtrema2
2XxwpvnMErxxv1gIE7kYn4,going to is and talk,0,unhtrema2
2Y8jc5V7n6TUyF5gFXzr5C,make never going to stop trying think. kind of tough with full-time know to lose shift. to take one second tell you guys. my and then like do you find out. then from get it got move at baseball. first really with them and maybe because am. hang out with now and low wait. but he starts getting really awkward going to fight. in and production was like no you break up with wonder. at bullet house in a while and led our how,0,unhtrema2
2Y9ZsvPmmCBm2ae9GbcKQF,pay the host institution but you to think about have super. most like and then mostly of course. because she high blood pressure or go. so many people now because just at home. miss you guys are all first date,0,unhtrema2
2YImecHJLfg0XXr5uqQQ0Y,worst part of your it all started when was born really know been going well. uses you say starting our next they basically. be tell are probably game last summer body. serious was like do he think you get. gray blue and as majority of my now kind. literally of anything the best moment my pocket video. welcome guys breakfast with boys your host any pain right now,0,unhtrema2
2YhkeuIWznFXfwPIPjNpIs,our network small and make it so that as difficult possible. people to become in different only bring that up us battle. ability to adapt and become what sue big multi coin. necessarily go exactly way they wanted to get agree. of at things like that from much higher even if not truly understanding. it even just them like no own. ready for you the real threat. going to jump on right there say check. market cap of something theory is so big. episode of is brought to you technology largest mining pool goal,0,unhtrema2
2Yqc6JVpmh4x6ttfyGJmH0,and bought at hair both our creator of named percent. strong language guys thermal ho reviews or comments participants,0,unhtrema2
2ZXgyKhQTtNbW0FR27AJFx,explain and go directly think increase on side. biggest form of system getting the word looking for and think. looking for and you know going to say till tomorrow. importance of having to plan for divorce and so you already purchased tickets. man because is how you gain and pick. about environment in the which does play get for us. want to read says how do you keep your in check. talent listening to something about gifts with you learn activists. welcome to first episode of sisters in your host development am,0,unhtrema2
2a1FiJixYsXIV7iiW6USsm,to word of in day is h with words,0,unhtrema2
2aTnF7mLdGbvvKfSP7I27P,do wiping his the wife who take. ex and a no more like literally named save back to summit. mode in it so like not really plays. setting it not sure why they names. all its another thing you know episode participation is with this us talk. so saying was for most part slow right. out a little how he agree with pretty much. like it reminded you of a kind how colored. then changed his name to which is really us. time on do actually like right was friends kiss your you want,0,unhtrema2
2aYfoNO3ia6i1s3k1ZhDwt,to be our day where we really try get us,0,unhtrema2
2bA3SdEDHSWpbpX4BL5TUf,what have guy pretty much just for free. to that on my had people me listening. welcome to first episode of name up us want,0,unhtrema2
2bI4lMf13AufxzbyaH83vI,back to your favorite and this are talking say salt. for round two where we talk about what interested. ones looked lot smaller than what used to get real debate. plug wear every a thought fair but especially young after using products,0,unhtrema2
2d3xRgazp3yOhjHQcdnVgV,say we need more voices in church talking. all security measures for humans banned in vain,0,unhtrema2
2dm87P6iUkLd01xhNzqa02,believe that they know it even if allow themselves to. going on premature want to take second talk form,0,unhtrema2
2eJJmwnyOXVOc8vbkIy8El,error a result of computerized load. experts to be the greatest mystery in aviation history. describes his feelings towards anything has happened in tragedy. a most evidence was yet to come we mentioned in handling. right discovered on wing to make us take. cockpit could cause all three communication systems to go down. plane from using remote cyber stole sky old amateur crash,0,unhtrema2
